A2: Tribunal Constitucional
A3: 38539
A5: N. Vis. | B5: H. Ing. | C5: Visitante | D5: T. Doc. | E5: N. Doc. | F5: Razón Visita | G5: Persona Visitada | H5: Observaciones | I5: H.Sal.
A6: 1 | B6: 08.17 | C6: Antenor Jorge | D6: DNI | E6: 08258548 | F6: Visita | G6: Dr. Juan Vergara Gotelli | I6: 08.19
A7: =(A6+1) -> 2 | B7: 08.17 | C7: Oscar Laines | D7: DNI | E7: 07292446 | F7: Visita | G7: Dr. Juan Vergara Gotelli | I7: 08.19
A8: =(A7+1) -> 3 | B8: 08.17 | C8: Marcelino Pedraza | D8: DNI | E8: 07912179 | F8: Visita | G8: Dr. Juan Vergara Gotelli | I8: 08.19
A9: =(A8+1) -> 4 | B9: 08.34 | C9: Roger Rodríguez | D9: DNI | E9: 07821253 | F9: Presidencia | G9: Presidencia | I9: 08.48
A10: =(A9+1) -> 5 | B10: 09.00 | C10: Ivonne Rojas | D10: DNI | E10: 06140498 | F10: Asesores | G10: Asesores | H10: Refrigerio | I10: 11.07
A11: =(A10+1) -> 6 | B11: 09.32 | C11: Manuel Bardelli | D11: DNI | E11: 08246608 | F11: Visita | G11: Dr. Juan Baustista Bardelli Lartirigoyen | I11: 10.25
A12: =(A11+1) -> 7 | B12: 09.32 | C12: Jorge Power | D12: DNI | E12: 09376051 | F12: Visita | G12: Dr. Victor Garcia Toma | I12: 10.09
A13: =(A12+1) -> 8 | B13: 09.35 | C13: Marysol Fernández | D13: DNI | E13: 00297410 | F13: Edecán | G13: Cmdte.Cumpa | I13: 10.32
A14: =(A13+1) -> 9 | B14: 09.38 | C14: Julio Araujo | D14: DNI | E14: 07795933 | F14: Presidencia | G14: Presidencia | I14: 09.42
A15: =(A14+1) -> 10 | B15: 09.43 | C15: José Castro | D15: DNI | E15: 10405319 | F15: Visita | G15: Dr. Juan Baustista Bardelli Lartirigoyen | I15: 09.48
A16: =(A15+1) -> 11 | B16: 09.46 | C16: Olga Crovetto | D16: DNI | E16: 06262272 | F16: Of.Bienestar | G16: Dra.Doris Díaz | I16: 11.24
A17: =(A16+1) -> 12 | B17: 09.46 | C17: Pedro Crovetto | D17: DNI | E17: 00926092 | F17: Of.Bienestar | G17: Dra.Doris Díaz | I17: 11.24
A18: =(A17+1) -> 13 | B18: 09.58 | C18: Percy Robles | D18: DNI | E18: 10153753 | F18: Abastecimient | G18: Sr. Jorge Borda | I18: 09.59
A19: =(A18+1) -> 14 | B19: 09.58 | C19: Juan José Abad | D19: DNI | E19: 08657907 | F19: R.R.P.P. | G19: Sr.Rojas | I19: 10.27
A20: =(A19+1) -> 15 | B20: 09.58 | C20: Lidia Gómez | D20: DNI | E20: 42340987 | F20: Asesores | G20: Dra.Rosado | H20: Refrigerio | I20: 10.04
A21: =(A20+1) -> 16 | B21: 10.08 | C21: José L.Armestar | D21: DNI | E21: 07090005 | F21: Serpost | G21: OTDA | I21: 13.44
A22: =(A21+1) -> 17 | B22: 10.14 | C22: Stalin Mendoza | D22: DNI | E22: 15859262 | F22: Visita | G22: Dr. Juan Baustista Bardelli Lartirigoyen | I22: 10.19
A23: =(A22+1) -> 18 | B23: 10.34 | C23: Wenimger Rivera | D23: DNI | E23: 41218295 | F23: Abastecimient | G23: Sr. Jorge Borda | I23: 10.45
A24: =(A23+1) -> 19 | B24: 10.46 | C24: Javier Luna | D24: DNI | E24: 10271374 | F24: Cedij | G24: Dr.Figueroa | I24: 11.10
A25: =(A24+1) -> 20 | B25: 10.48 | C25: Carlos Céspedes | D25: DNI | E25: 07615320 | F25: Visita | G25: Dr. Juan Baustista Bardelli Lartirigoyen | I25: 12.33
A26: =(A25+1) -> 21 | B26: 11.07 | C26: Carlos Artieda | D26: DNI | E26: 72064116 | F26: Presidencia | G26: Presidencia | I26: 12.26
A27: =(A26+1) -> 22 | B27: 11.07 | C27: Cinthya Arguedas | D27: DNI | E27: 00165436 | F27: Presidencia | G27: Presidencia | I27: 12.26
A28: =(A27+1) -> 23 | B28: 11.07 | C28: Raymundo Arroyo | D28: DNI | E28: 00105756 | F28: Presidencia | G28: Presidencia | I28: 12.26
A29: =(A28+1) -> 24 | B29: 11.07 | C29: Gonzalo Deustua | D29: DNI | E29: 10224054 | F29: Presidencia | G29: Presidencia | I29: 12.26
A30: =(A29+1) -> 25 | B30: 11.07 | C30: Fabrizio Franco | D30: DNI | E30: 06428479 | F30: Pnud | G30: PNUD | I30: 15.18
A31: =(A30+1) -> 26 | B31: 11.29 | C31: Yris Alvarez | D31: DNI | E31: 17926654 | F31: Of.Bienestar | G31: Dra.Doris Díaz | I31: 11.40
A32: =(A31+1) -> 27 | B32: 11.30 | C32: Brigida Turpo | D32: DNI | E32: 00991149 | F32: R.R.P.P. | G32: Sr.Rojas | I32: 11.34
A33: =(A32+1) -> 28 | B33: 11.50 | C33: Edilburga Bambaren | D33: DNI | E33: 06226939 | F33: Personal | G33: Sra.Ordoñez | I33: 12.40
A34: =(A33+1) -> 29 | B34: 11.57 | C34: Miguel A.Grandez | D34: DNI | E34: 10408799 | F34: Personal | G34: Sr.Ramos | I34: 12.16
A35: =(A34+1) -> 30 | B35: 12.06 | C35: Atilio Cesti C. | D35: DNI | E35: 25779415 | F35: Tesorer¡a | G35: Sr.Novoa | I35: 12.21
A36: =(A35+1) -> 31 | B36: 12.06 | C36: Rodolfo Soto | D36: DNI | E36: 08274849 | F36: Abastecimient | G36: Sr. Jorge Borda | I36: 12.10
A37: =(A36+1) -> 32 | B37: 12.08 | C37: José Noroña | D37: DNI | E37: 06257703 | F37: Personal | G37: Sra.Ordoñez | I37: 12.12
A38: =(A37+1) -> 33 | B38: 12.13 | C38: Alexis Villagra | D38: DNI | E38: 09389680 | F38: Auditoria I. | G38: Ing.Espinoza | I38: 13.28
A39: =(A38+1) -> 34 | B39: 12.20 | C39: Hans Panuera | D39: DNI | E39: 41120843 | F39: G.General | G39: Dr. Oscar del Rio | I39: 12.28
A40: =(A39+1) -> 35 | B40: 12.30 | C40: Roberto Quijano | D40: DNI | E40: 09668160 | F40: Abastecimient | G40: Sr. Jorge Borda | I40: 12.45
A41: =(A40+1) -> 36 | B41: 12.31 | C41: Alonso González | D41: DNI | E41: 07436225 | F41: Abastecimient | G41: Sr. Jorge Borda | I41: 12.45
A42: =(A41+1) -> 37 | B42: 12.36 | C42: José Chavez | D42: DNI | E42: 42725976 | F42: Cafeter¡a | G42: Sr.M.Rojas | I42: 12.44
A43: =(A42+1) -> 38 | B43: 12.48 | C43: Juan C. Ochoa | D43: DNI | E43: 16011297 | F43: Visita | G43: Dr. Juan Baustista Bardelli Lartirigoyen | I43: 12.58
A44: =(A43+1) -> 39 | B44: 12.50 | C44: Hilda Cordova | D44: DNI | E44: 07608996 | F44: Visita | G44: Dr. Juan Vergara Gotelli | I44: 14.30
A45: =(A44+1) -> 40 | B45: 13.02 | C45: Juan José Abad | D45: DNI | E45: 08657907 | F45: R.R.P.P. | G45: Sr.Rojas | I45: 14.06
A46: =(A45+1) -> 41 | B46: 13.09 | C46: Norma Pacora | D46: DNI | E46: 08054273 | F46: Secre.General | G46: Dr. Carlos Pelaez Camacho | I46: 13.28
A47: =(A46+1) -> 42 | B47: 13.09 | C47: Susana Azañero | D47: DNI | E47: 25703584 | F47: Secre.General | G47: Dr. Carlos Pelaez Camacho | I47: 13.28
A48: =(A47+1) -> 43 | B48: 13.21 | C48: Germán Muñoz | D48: DNI | E48: 07937479 | F48: Visita | G48: Dr. Juan Vergara Gotelli | I48: 14.23
A49: =(A48+1) -> 44 | B49: 13.30 | C49: María Chaviguri | D49: DNI | E49: 10285406 | F49: Visita | G49: Dr. Juan Vergara Gotelli | I49: 14.30
A50: =(A49+1) -> 45 | B50: 13.49 | C50: Rolando Melgar | D50: DNI | E50: 08555189 | F50: G.General | G50: Dr. Oscar del Rio | I50: 13.54
A51: =(A50+1) -> 46 | B51: 14.00 | C51: Luz Bedon | D51: DNI | E51: 44009675 | F51: Secretarias | G51: Sra.Guevara | H51: Refrigerio | I51: 14.30
A52: =(A51+1) -> 47 | B52: 14.01 | C52: Amadeo Delgado | D52: DNI | E52: 40068192 | F52: Abastecimient | G52: Sr. Jorge Borda | I52: 14.08
A53: =(A52+1) -> 48 | B53: 14.34 | C53: Juan C. Ochoa | D53: DNI | E53: 16011297 | F53: Visita | G53: Dr. Juan Baustista Bardelli Lartirigoyen | I53: 15.17
A54: =(A53+1) -> 49 | B54: 14.42 | C54: Luis Correa | D54: DNI | E54: 25841966 | F54: Cedij | G54: Dr.Reategui | I54: 15.00
A55: =(A54+1) -> 50 | B55: 14.46 | C55: Fortunato de la Cru | D55: DNI | E55: 09636368 | F55: Personal | G55: Sra.Ordoñez | I55: 15.11
A56: =(A55+1) -> 51 | B56: 14.46 | C56: Martín Sotelo | D56: DNI | E56: 07638550 | F56: Personal | G56: Sra.Ordoñez | I56: 15.11
A57: =(A56+1) -> 52 | B57: 14.56 | C57: Juan Medina | D57: DNI | E57: 07577513 | F57: Visita | G57: Dr. Magdiel Gonzales Ojeda | I57: 15.22
A58: =(A57+1) -> 53 | B58: 14.57 | C58: Rosa Alvarado | D58: DNI | E58: 25730168 | F58: Visita | G58: Dr. Juan Baustista Bardelli Lartirigoyen | I58: 15.29
A59: =(A58+1) -> 54 | B59: 15.02 | C59: Cesáreo Cotrina | D59: DNI | E59: 15983785 | F59: Visita | G59: Dr. Juan Baustista Bardelli Lartirigoyen | I59: 16.00
A60: =(A59+1) -> 55 | B60: 15.02 | C60: Roberto Sevillano | D60: DNI | E60: 25827904 | F60: Visita | G60: Dr. Juan Baustista Bardelli Lartirigoyen | I60: 15.47
A61: =(A60+1) -> 56 | B61: 15.07 | C61: Juan P.Huanca | D61: DNI | E61: 29628069 | F61: Tesorería | G61: Sr.Novoa | I61: 15.47
A62: =(A61+1) -> 57 | B62: 15.40 | C62: María Huata | D62: DNI | E62: 08832313 | F62: Of.Bienestar | G62: Dra.Doris Diaz | I62: 16.02
A63: =(A62+1) -> 58 | B63: 15.40 | C63: Carmen Chambi | D63: DNI | E63: 07339900 | F63: Of.Bienestar | G63: Dra.Doris Diaz | I63: 17.05
A64: =(A63+1) -> 59 | B64: 15.41 | C64: Roberto Quijano | D64: DNI | E64: 09668160 | F64: Abastecimient | G64: Sr. Jorge Borda | I64: 15.55
A65: =(A64+1) -> 60 | B65: 15.41 | C65: Ana Nuñez | D65: DNI | E65: 18207670 | F65: Visita | G65: Dr. Magdiel Gonzales Ojeda | I65: 16.04
A66: =(A65+1) -> 61 | B66: 15.43 | C66: Maria Dragg | D66: DNI | E66: 25796182 | F66: Visita | G66: Dr. M.Reategui | I66: 16.31
A67: =(A66+1) -> 62 | B67: 15.46 | C67: Fernando Peña | D67: DNI | E67: 06069781 | F67: Abastecimient | G67: Sr. Jorge Borda | I67: 15.48
A68: =(A67+1) -> 63 | B68: 15.54 | C68: Jorge Alferrano | D68: DNI | E68: 07925901 | F68: Visita | G68: Dr. Juan Baustista Bardelli Lartirigoyen | I68: 16.17
A69: =(A68+1) -> 64 | B69: 15.55 | C69: Rosa Leon | D69: DNI | E69: 08262983 | F69: G.General | G69: Dr. Oscar del Rio Gonzales | I69: 16.09
A70: =(A69+1) -> 65 | B70: 16.04 | C70: Emilio Enriquez | D70: DNI | E70: 09306730 | F70: Visita | G70: Dr. Juan Baustista Bardelli Lartirigoyen | I70: 16.40
A71: =(A70+1) -> 66 | B71: 16.04 | C71: Alfredo Mendiola | D71: DNI | E71: 21491938 | F71: Visita | G71: Dr. Juan Baustista Bardelli Lartirigoyen | I71: 16.30
A72: =(A71+1) -> 67 | B72: 16.05 | C72: Martin Nilupu | D72: DNI | E72: 03372296 | F72: Visita | G72: Dr. Magdiel Gonzales Ojeda | I72: 17.33
A73: =(A72+1) -> 68 | B73: 16.21 | C73: Cesar Rivarola | D73: DNI | E73: 06644287 | F73: G.General | G73: Dr. Oscar del Rio Gonzales | I73: 16.43
A74: =(A73+1) -> 69 | B74: 16.21 | C74: Geshler Mariciano | D74: DNI | E74: 06594878 | F74: G.General | G74: Dr. Oscar del Rio Gonzales | I74: 18.35
A75: =(A74+1) -> 70 | B75: 16.27 | C75: Robinson Ocampo | D75: DNI | E75: 10684463 | F75: G.General | G75: Dr. Oscar del Rio Gonzales | I75: 16.29
A76: =(A75+1) -> 71 | B76: 16.35 | C76: Jesus Magallanes | D76: DNI | E76: 40216312 | F76: Visita | G76: Dr. Che-Piu | I76: 17.10
A77: =(A76+1) -> 72 | B77: 16.36 | C77: Dioni Alvarado | D77: DNI | E77: 10311679 | F77: Personal | G77: Sra.Ordoñez | I77: 16.55
A78: =(A77+1) -> 73 | B78: 16.36 | C78: Rosa Rodríguez | D78: DNI | E78: 08192703 | F78: Personal | G78: Sra.Ordoñez | I78: 16.55
A79: =(A78+1) -> 74 | B79: 17.36 | C79: Norma Rodríguez | D79: DNI | E79: 00922806 | F79: Auditoria I. | G79: Sr.Ramirez | I79: 17.52
A80: =(A79+1) -> 75 | B80: 18.00 | C80: Herbert Zuñiga | D80: DNI | E80: 29306639 | F80: G.General | G80: Dr. Oscar del Rio | I80: 19.49