A2: Tribunal Constitucional
A3: 38534
A5: N. Vis. | B5: H. Ing. | C5: Visitante | D5: T. Doc. | E5: N. Doc. | F5: Razón Visita | G5: Persona Visitada | H5: Observaciones | I5: H.Sal.
A6: 1 | B6: 08.15 | C6: Ernesto Bermudez | D6: DNI | E6: 22515002 | F6: Visita | G6: Dr. Juan Vergara Gotelli | H6: Visita | I6: 08.31
A7: =(A6+1) -> 2 | B7: 08.32 | C7: Fernando Larrauri | D7: DNI | E7: 08752739 | F7: Visita | G7: Dr. Juan Vergara Gotelli | H7: Visita | I7: 08.59
A8: =(A7+1) -> 3 | B8: 09.00 | C8: Roberto Colqui | D8: DNI | E8: 04068053 | F8: Entrevista | G8: Dra.De Los Rios | H8: Entrevista | I8: 09.06
A9: =(A8+1) -> 4 | B9: 09.02 | C9: Marco Ramirez | D9: DNI | E9: 31649674 | F9: Entrevista | G9: Dra.De Los Rios | H9: Entrevista | I9: 09.10
A10: =(A9+1) -> 5 | B10: 09.03 | C10: Eulogio Heredia | D10: DNI | E10: 31651424 | F10: Entrevista | G10: Dra.De Los Rios | H10: Entrevista | I10: 09.14
A11: =(A10+1) -> 6 | B11: 09.04 | C11: Ivonne Rojas | D11: DNI | E11: 06140498 | F11: Asesores | G11: Asesores | H11: Refrigerio | I11: 11.01
A12: =(A11+1) -> 7 | B12: 09.10 | C12: Nicanor Paccioni | D12: DNI | E12: 06701061 | F12: Entrevista | G12: Dra.De Los Rios | H12: Entrevista | I12: 09.25
A13: =(A12+1) -> 8 | B13: 09.14 | C13: Teho Garcia | D13: DNI | E13: 08092781 | F13: Entrevista | G13: Dra.De Los Rios | H13: Entrevista | I13: 09.26
A14: =(A13+1) -> 9 | B14: 09.32 | C14: Delfin Gavilano | D14: DNI | E14: 40115855 | F14: Visita | G14: Dr. Alzamora | H14: Visita | I14: 10.03
A15: =(A14+1) -> 10 | B15: 09.44 | C15: Juan Pardo | D15: DNI | E15: 08122665 | F15: G.General | G15: Dr. Oscar del Rio Gonzales | H15: G.General | I15: 09.49
A16: =(A15+1) -> 11 | B16: 10.08 | C16: Eladio Gonzales | D16: DNI | E16: 31609735 | F16: Visita | G16: Dr. Juan Baustista Bardelli Lartirigoyen | H16: Visita | I16: 10.47
A17: =(A16+1) -> 12 | B17: 10.10 | C17: Felix Jurado | D17: DNI | E17: 07614867 | F17: Visita | G17: Dr. Juan Vergara Gotelli | H17: Visita | I17: 11.15
A18: =(A17+1) -> 13 | B18: 10.10 | C18: Bernardino Romani | D18: DNI | E18: 07275044 | F18: Visita | G18: Dr. Juan Vergara Gotelli | H18: Visita | I18: 11.15
A19: =(A18+1) -> 14 | B19: 10.10 | C19: Eduardo Romani | D19: DNI | E19: 10316695 | F19: Visita | G19: Dr. Juan Vergara Gotelli | H19: Visita | I19: 11.15
A20: =(A19+1) -> 15 | B20: 10.14 | C20: Samuel Miraval | D20: DNI | E20: 04031351 | F20: Carpintero | G20: Dr. César Landa Arroyo | H20: Carpintero | I20: 19.00
A21: =(A20+1) -> 16 | B21: 10.19 | C21: Jose Luis Armestar | D21: DNI | E21: 07090005 | F21: Serpost | G21: OTDA | H21: Serpost | I21: 12.49
A22: =(A21+1) -> 17 | B22: 10.25 | C22: Jose Luis Delgado N | D22: DNI | F22: Visita | G22: Dr. Juan Vergara Gotelli | H22: Visita | I22: 11.30
A23: =(A22+1) -> 18 | B23: 10.29 | C23: Doris Diaz Burga | D23: DNI | F23: Destacada | G23: Of. Bienestar | H23: Destacada | I23: 18.30
A24: =(A23+1) -> 19 | B24: 10.39 | C24: Hugo Delgado | D24: DNI | E24: 08273018 | F24: Visita | G24: Dr. Cubas | H24: Visita | I24: 11.00
A25: =(A24+1) -> 20 | B25: 10.45 | C25: Guillermo Yaricahua | D25: DNI | E25: 10390791 | F25: Of. Finanzas | G25: Sr. Villagarcia | H25: Of. Finanza | I25: 11.07
A26: =(A25+1) -> 21 | B26: 11.05 | C26: Jose Luis Valverde | D26: DNI | E26: 10880602 | F26: Carpintero | G26: Dr. César Landa Arroyo | H26: Carpintero | I26: 19.00
A27: =(A26+1) -> 22 | B27: 11.35 | C27: Sepiriano Grimaldo | D27: DNI | E27: 10535965 | F27: Abastecimient | G27: Sra. Linares | H27: Abastecimie | I27: 12.19
A28: =(A27+1) -> 23 | B28: 11.36 | C28: Marlon Marthans | D28: DNI | E28: 40100954 | F28: Carpintero | G28: Dr. César Landa Arroyo | H28: Carpintero | I28: 19.00
A29: =(A28+1) -> 24 | B29: 11.45 | C29: Hugo Delgado | D29: DNI | E29: 08273018 | F29: Visita | G29: Dr. Juan Baustista Bardelli Lartirigoyen | H29: Visita | I29: 11.52
A30: =(A29+1) -> 25 | B30: 12.28 | C30: Maximo Perez | D30: DNI | E30: 07821871 | F30: Visita | G30: Sra. Doris Alarcon | H30: Visita | I30: 12.32
A31: =(A30+1) -> 26 | B31: 12.55 | C31: Jose Torres | D31: DNI | E31: 60544547 | F31: Visita | G31: Dr. Juan Baustista Bardelli Lartirigoyen | H31: Visita | I31: 12.57
A32: =(A31+1) -> 27 | B32: 13.00 | C32: Raul Flores | D32: DNI | E32: 43582689 | F32: Asesores | G32: Dr.De La Puente | H32: Refrigerio | I32: 13.10
A33: =(A32+1) -> 28 | B33: 13.02 | C33: Digna Carguallanqui | D33: DNI | E33: 19838120 | F33: Asesores | G33: Dra.Rosado | H33: Refrigerio | I33: 13.15
A34: =(A33+1) -> 29 | B34: 13.03 | C34: Juan Balta Olarte | D34: DNI | E34: 07960058 | F34: Visita | G34: Dr. Juan Baustista Bardelli Lartirigoyen | H34: Visita | I34: 13.13
A35: =(A34+1) -> 30 | B35: 13.06 | C35: Maximo Antezana | D35: DNI | E35: 06057211 | F35: Visita | G35: Dr. Juan Vergara Gotelli | H35: Visita | I35: 13.13
A36: =(A35+1) -> 31 | B36: 14.10 | C36: Pedro Grandez | D36: DNI | E36: 09461824 | F36: Visita | G36: Dr. Magdiel Gonzales Ojeda | H36: Visita | I36: 16.45
A37: =(A36+1) -> 32 | B37: 14.24 | C37: Alejandro Ordoñez | D37: DNI | E37: 08139452 | F37: Dpto.Personal | G37: Sra.Ordoñez | H37: Dpto.Person | I37: 14.30
A38: =(A37+1) -> 33 | B38: 14.30 | C38: Rody Heredia | D38: DNI | E38: 42499751 | F38: Abastecimient | G38: Sr. Jorge Borda | H38: Abastecimie | I38: 15.12
A39: =(A38+1) -> 34 | B39: 14.55 | C39: Raquel Perez | D39: DNI | E39: 08900379 | F39: Visita | G39: Dr. Juan Baustista Bardelli Lartirigoyen | H39: Visita | I39: 15.23
A40: =(A39+1) -> 35 | B40: 14.58 | C40: Delfin Gavilano | D40: DNI | E40: 40115855 | F40: Visita | G40: Dr. Alzamora | H40: Visita | I40: 15.10
A41: =(A40+1) -> 36 | B41: 15.03 | C41: Stalin Mendoza | D41: DNI | E41: 80106972 | F41: Visita | G41: Dr. Juan Baustista Bardelli Lartirigoyen | H41: Visita | I41: 19.00
A42: =(A41+1) -> 37 | B42: 15.15 | C42: Yenny Reyes | D42: DNI | E42: 18072461 | F42: Of.Bienestar | G42: Dra. Doris Diaz | H42: Of.Bienesta | I42: 16.19
A43: =(A42+1) -> 38 | B43: 15.18 | C43: Rosa Ñontal | D43: DNI | E43: 09612968 | F43: Of.Personal | G43: Sr.Ramos | H43: Of.Personal | I43: 15.29
A44: =(A43+1) -> 39 | B44: 15.18 | C44: Flor Bustios | D44: DNI | E44: 08428506 | F44: Of.Personal | G44: Sr.Ramos | H44: Of.Personal | I44: 15.29
A45: =(A44+1) -> 40 | B45: 15.48 | C45: Abelardo Flores | D45: DNI | E45: 20556876 | F45: Visita | G45: Dr. Carpio | H45: Visita | I45: 16.00
A46: =(A45+1) -> 41 | B46: 15.50 | C46: Santos Sanchez | D46: DNI | E46: 08188262 | F46: Visita | G46: Dr. Juan Baustista Bardelli Lartirigoyen | H46: Visita | I46: 15.58
A47: =(A46+1) -> 42 | B47: 16.07 | C47: Americo Arana | D47: DNI | E47: 07341905 | F47: Of.Bienestar | G47: Dra.Doris Diaz | H47: Of.Bienesta | I47: 16.39
A48: =(A47+1) -> 43 | B48: 16.07 | C48: Braulio Grimaldo | D48: DNI | E48: 10289440 | F48: Carpintero | G48: Dr. César Landa Arroyo | H48: Carpintero | I48: 16.29
A49: =(A48+1) -> 44 | B49: 16.18 | C49: Maria Cabañas | D49: DNI | E49: 07413962 | F49: Silsa | G49: Silsa | H49: Silsa | I49: 16.45
A50: =(A49+1) -> 45 | B50: 16.20 | C50: Jorge Ferrer | D50: DNI | E50: 06199163 | F50: Abastecimient | G50: Sr. Jorge Borda | H50: Abastecimie | I50: 16.45
A51: =(A50+1) -> 46 | B51: 16.36 | C51: Tomas Tello | D51: DNI | E51: 06020403 | F51: Visita | G51: Dr. Che- Piu | H51: Visita | I51: 16.48
A52: =(A51+1) -> 47 | B52: 16.40 | C52: Jesus Magallanes | D52: DNI | E52: 40216312 | F52: Visita | G52: Dr. Adrian | H52: Visita | I52: 17.00
A53: =(A52+1) -> 48 | B53: 16.47 | C53: Miguel Reyes | D53: DNI | E53: 40189604 | F53: Abastecimient | G53: Sr. Jorge Borda | H53: Abastecimie | I53: 16.49
A54: =(A53+1) -> 49 | B54: 17.00 | C54: Braulio Grimaldo | D54: DNI | E54: 10289440 | F54: Carpintero | G54: Dr. César Landa Arroyo | H54: Carpintero | I54: 19.00
A55: =(A54+1) -> 50 | B55: 17.00 | C55: Maribel Chacon | D55: DNI | E55: 41939317 | F55: Visita | G55: Dr. Carpio | H55: Visita | I55: 17.30
A56: =(A55+1) -> 51 | B56: 17.20 | C56: Patricia Walters | D56: DNI | E56: 09643383 | F56: Visita | G56: Sra. Walters | H56: Visita | I56: 17.25
A57: =(A56+1) -> 52 | B57: 17.20 | C57: Isabel Walters | D57: DNI | E57: 10372163 | F57: Visita | G57: Sra. Walters | H57: Visita | I57: 17.25