A2: Tribunal Constitucional
A3: 38540
A5: N. Vis. | B5: H. Ing. | C5: Visitante | D5: T. Doc. | E5: N. Doc. | F5: Razón Visita | G5: Persona Visitada | H5: Observaciones | I5: H.Sal.
A6: 1 | B6: 08.32 | C6: Mario Daneri | D6: DNI | E6: 07810285 | F6: Presidencia | G6: Presidencia | I6: 08.55
A7: =(A6+1) -> 2 | B7: 08.32 | C7: Felix Dongo | D7: DNI | E7: 16710527 | F7: Presidencia | G7: Presidencia | I7: 08.55
A8: =(A7+1) -> 3 | B8: 08.54 | C8: Carlos Grados | D8: DNI | E8: 15691963 | F8: Presidencia | G8: Presidencia | I8: 09.28
A9: =(A8+1) -> 4 | B9: 08.54 | C9: Cesar Baiylon | D9: DNI | E9: 15750149 | F9: Presidencia | G9: Presidencia | I9: 09.28
A10: =(A9+1) -> 5 | B10: 08.58 | C10: Ivonne Rojas | D10: DNI | E10: 06140498 | F10: Asesores | G10: Asesores | H10: Refrigerio | I10: 10.20
A11: =(A10+1) -> 6 | B11: 08.58 | C11: Ernesto Trujillo | D11: DNI | E11: 41228265 | F11: Of.Informatic | G11: Ing. Rodriguez | H11: Practicante | I11: 13.03
A12: =(A11+1) -> 7 | B12: 09.03 | C12: Jorge Avendaño | D12: DNI | E12: 07817005 | F12: Presidencia | G12: Presidencia | I12: 09.30
A13: =(A12+1) -> 8 | B13: 09.16 | C13: Julia Gutiérrez | D13: DNI | E13: 07272100 | F13: Tesorer¡a | G13: Sr.Novoa | I13: 09.25
A14: =(A13+1) -> 9 | B14: 09.25 | C14: Luis Martorell | D14: DNI | E14: 00410440 | F14: Presidencia | G14: Presidencia | I14: 09.51
A15: =(A14+1) -> 10 | B15: 09.25 | C15: Wendy Middlebrock | D15: DNI | E15: 42349506 | F15: Presidencia | G15: Presidencia | I15: 09.51
A16: =(A15+1) -> 11 | B16: 09.27 | C16: Enrique Gutiérrez | D16: DNI | E16: 07471067 | F16: Visita | G16: Dr. Victor Garcia Toma | I16: 09.53
A17: =(A16+1) -> 12 | B17: 09.27 | C17: Gladys Freyre | D17: DNI | E17: 09162657 | F17: Visita | G17: Dr. Victor Garcia Toma | I17: 09.53
A18: =(A17+1) -> 13 | B18: 09.28 | C18: Fabrizio Franco | D18: DNI | E18: 06428479 | F18: Pnud | G18: PNUD | I18: 12.58
A19: =(A18+1) -> 14 | B19: 09.41 | C19: Cinthya Arguedas | D19: DNI | E19: 00165436 | F19: Pnud | G19: Sr. Fabricio Franco | I19: 12.41
A20: =(A19+1) -> 15 | B20: 09.41 | C20: Andrés Roa | D20: DNI | E20: 41362558 | F20: Pnud | G20: Sr.Franco | I20: 12.41
A21: =(A20+1) -> 16 | B21: 09.41 | C21: Carlos Artieda | D21: DNI | E21: 07208416 | F21: Pnud | G21: Sr.Franco | I21: 12.41
A22: =(A21+1) -> 17 | B22: 09.54 | C22: Juan Monroy | D22: DNI | E22: 07571335 | F22: Visita | G22: Dr. César Landa Arroyo | I22: 10.08
A23: =(A22+1) -> 18 | B23: 10.12 | C23: Eduardo Coloma | D23: DNI | E23: 08803063 | F23: Abastecimient | G23: Sr. Jorge Borda | I23: 10.40
A24: =(A23+1) -> 19 | B24: 10.19 | C24: Sandra Bigio | D24: DNI | E24: 08236951 | F24: Visita | G24: Dr. César Landa Arroyo | I24: 11.13
A25: =(A24+1) -> 20 | B25: 10.19 | C25: José L.Armestar | D25: DNI | E25: 07090005 | F25: Serpost | G25: OTDA | I25: 14.00
A26: =(A25+1) -> 21 | B26: 10.29 | C26: Máximo Araujo | D26: DNI | E26: 10611231 | F26: Visita | G26: Dr. Juan Baustista Bardelli Lartirigoyen | I26: 11.00
A27: =(A26+1) -> 22 | B27: 10.45 | C27: Miguel A.Grandez | D27: DNI | E27: 10408799 | F27: Personal | G27: Sr.Ramos | I27: 11.10
A28: =(A27+1) -> 23 | B28: 10.47 | C28: Oscar Morales | D28: DNI | E28: 07953540 | F28: Visita | G28: Dr. Juan Baustista Bardelli Lartirigoyen | I28: 11.07
A29: =(A28+1) -> 24 | B29: 10.47 | C29: Maura Bermúdez | D29: DNI | E29: 07418677 | F29: Visita | G29: Dr. Juan Baustista Bardelli Lartirigoyen | I29: 11.07
A30: =(A29+1) -> 25 | B30: 10.48 | C30: Pedro de las Casas | D30: DNI | E30: 10540314 | F30: Visita | G30: Dr. Juan Vergara Gotelli | I30: 11.05
A31: =(A30+1) -> 26 | B31: 10.50 | C31: Guillermo Bermúdez | D31: DNI | E31: 07718092 | F31: Cedij | G31: Sra.Marin | I31: 10.52
A32: =(A31+1) -> 27 | B32: 10.58 | C32: Doris Díaz | D32: DNI | F32: Destacada | G32: Of.Bienestar | I32: 14.23
A33: =(A32+1) -> 28 | B33: 10.59 | C33: David Aranaga | D33: DNI | E33: 08718267 | F33: Visita | G33: Dr. Magdiel Gonzales Ojeda | I33: 11.28
A34: =(A33+1) -> 29 | B34: 11.05 | C34: Pedro Flores | D34: DNI | E34: 08377719 | F34: Visita | G34: Dr. Juan Vergara Gotelli | I34: 11.35
A35: =(A34+1) -> 30 | B35: 11.13 | C35: Manuela Arroyo | D35: DNI | E35: 07200765 | F35: Visita | G35: Dr. Juan Baustista Bardelli Lartirigoyen | I35: 12.10
A36: =(A35+1) -> 31 | B36: 11.23 | C36: Manuel Gracia | D36: DNI | E36: 10316537 | F36: Presidencia | G36: Presidencia | I36: 11.57
A37: =(A36+1) -> 32 | B37: 11.43 | C37: Dativa Monteagudo | D37: DNI | E37: 06206808 | F37: Personal | G37: Sra.Ordoñez | I37: 12.06
A38: =(A37+1) -> 33 | B38: 11.44 | C38: Jaime Flores | D38: DNI | E38: 09320652 | F38: R.R.P.P. | G38: Sr.Rojas | I38: 12.12
A39: =(A38+1) -> 34 | B39: 11.44 | C39: Hugo Valverde | D39: DNI | E39: 06477057 | F39: R.R.P.P. | G39: Sr.Rojas | I39: 12.12
A40: =(A39+1) -> 35 | B40: 11.58 | C40: Luisa Pérez | D40: DNI | E40: 07230774 | F40: Visita | G40: Dr. Juan Baustista Bardelli Lartirigoyen | I40: 12.08
A41: =(A40+1) -> 36 | B41: 12.02 | C41: Adolfo Ferró | D41: DNI | E41: 43306552 | F41: Visita | G41: Dr. Juan Baustista Bardelli Lartirigoyen | I41: 12.20
A42: =(A41+1) -> 37 | B42: 12.15 | C42: Rolando Melgar | D42: DNI | E42: 08555189 | F42: G.General | G42: Dr. Oscar del Rio | I42: 13.00
A43: =(A42+1) -> 38 | B43: 12.17 | C43: María Cabañas | D43: DNI | E43: 74139632 | F43: Silsa | G43: Silsa | I43: 12.41
A44: =(A43+1) -> 39 | B44: 12.21 | C44: Dativa Monteagudo | D44: DNI | E44: 06206808 | F44: Asesor Legal | G44: Dr.Dumet | I44: 12.38
A45: =(A44+1) -> 40 | B45: 12.28 | C45: Crisantemo Tamayo | D45: DNI | E45: 08937295 | F45: G.General | G45: Dr. Oscar del Rio | I45: 12.50
A46: =(A45+1) -> 41 | B46: 12.32 | C46: Eduardo Sánchez | D46: DNI | E46: 07937017 | F46: Visita | G46: Dra. DeLos Ríos | I46: 12.49
A47: =(A46+1) -> 42 | B47: 12.43 | C47: Ivan Sánchez | D47: DNI | E47: 06651298 | F47: Of.Bienestar | G47: Dra. Doris Díaz | I47: 13.02
A48: =(A47+1) -> 43 | B48: 12.53 | C48: Stalin Mendoza | D48: DNI | E48: 15859262 | F48: OTDA | G48: Dra.Cordova | I48: 13.11
A49: =(A48+1) -> 44 | B49: 12.53 | C49: Patricia Sánchez | D49: DNI | E49: 18212467 | F49: Of.Bienestar | G49: Dra.Doris Díaz | I49: 13.00
A50: =(A49+1) -> 45 | B50: 13.07 | C50: Luz Bedon | D50: DNI | E50: 44009675 | F50: Relaciones Públicas | G50: Srta.Franco | H50: Refrigerio | I50: 14.10
A51: =(A50+1) -> 46 | B51: 13.12 | C51: Stalin Mendoza | D51: DNI | E51: 15859262 | F51: Visita | G51: Dr. Juan Baustista Bardelli Lartirigoyen | I51: 15.12
A52: =(A51+1) -> 47 | B52: 13.13 | C52: Cesar Rivarola | D52: DNI | E52: 06644287 | F52: Visita | G52: Dr. Juan Baustista Bardelli Lartirigoyen | I52: 13.15
A53: =(A52+1) -> 48 | B53: 13.43 | C53: Lourdes Quiroz | D53: DNI | E53: 15374010 | F53: Visita | G53: Dr. Juan Vergara Gotelli | I53: 14.29
A54: =(A53+1) -> 49 | B54: 13.43 | C54: Gissela Morales | D54: DNI | E54: 41719256 | F54: Visita | G54: Dr. Juan Vergara Gotelli | I54: 14.29
A55: =(A54+1) -> 50 | B55: 13.50 | C55: Juan Leon | D55: DNI | E55: 27144696 | F55: R.R.P.P. | G55: Sr.Rojas | I55: 14.12
A56: =(A55+1) -> 51 | B56: 13.50 | C56: Lucy Anaya | D56: DNI | E56: 41203993 | F56: R.R.P.P. | G56: Sr.Rojas | I56: 14.04
A57: =(A56+1) -> 52 | B57: 14.03 | C57: Digna Carhuallanqui | D57: DNI | E57: 19838120 | F57: Asesores | G57: Dra.Rosado | H57: Refrigerio | I57: 14.04
A58: =(A57+1) -> 53 | B58: 14.08 | C58: Patricia Sánchez | D58: DNI | F58: Of.Bienestar | G58: Dra.Doris Díaz | I58: 14.23
A59: =(A58+1) -> 54 | B59: 14.10 | C59: Juan Pardo | D59: DNI | E59: 08122665 | F59: Of.Bienestar | G59: Dra.Doris Díaz | I59: 14.14
A60: =(A59+1) -> 55 | B60: 14.13 | C60: Julián Videla | D60: DNI | E60: 06056729 | F60: Personal | G60: Sr.Ramos | I60: 14.20
A61: =(A60+1) -> 56 | B61: 14.50 | C61: Valentín Rivera | D61: DNI | E61: 25657400 | F61: Abastecimient | G61: Sr. Jorge Borda | I61: 14.56
A62: =(A61+1) -> 57 | B62: 14.50 | C62: Raymundo Pajares | D62: DNI | E62: 06068466 | F62: Abastecimient | G62: Sr. Jorge Borda | I62: 14.58
A63: =(A62+1) -> 58 | B63: 14.52 | C63: Alonso González | D63: DNI | E63: 07436225 | F63: Abastecimient | G63: Sr. Jorge Borda | I63: 15.49
A64: =(A63+1) -> 59 | B64: 15.00 | C64: Juan Pardo | D64: DNI | E64: 08122665 | F64: Visita | G64: Sra. Ferreyros | I64: 15.33
A65: =(A64+1) -> 60 | B65: 15.02 | C65: Fabrizio Franco | D65: DNI | E65: 06428479 | F65: Pnud | G65: PNUD | I65: 15.25
A66: =(A65+1) -> 61 | B66: 15.10 | C66: Roque Pérez | D66: DNI | E66: 08900379 | F66: Visita | G66: Dr. Juan Baustista Bardelli Lartirigoyen | I66: 15.35
A67: =(A66+1) -> 62 | B67: 15.10 | C67: Julio Paredes | D67: DNI | E67: 09740712 | F67: Visita | G67: Dr. Juan Baustista Bardelli Lartirigoyen | I67: 15.35
A68: =(A67+1) -> 63 | B68: 15.17 | C68: Janeth Chacon | D68: DNI | E68: 10449211 | F68: Visita | G68: Dr. Carpio | I68: 15.20
A69: =(A68+1) -> 64 | B69: 15.31 | C69: Juan P.Huanca | D69: DNI | E69: 29628069 | F69: Tesorer¡a | G69: Sr.Novoa | I69: 15.50
A70: =(A69+1) -> 65 | B70: 15.46 | C70: Cesar Rivarola | D70: DNI | E70: 06644287 | F70: Visita | G70: Dr. Juan Baustista Bardelli Lartirigoyen | I70: 15.57
A71: =(A70+1) -> 66 | B71: 15.55 | C71: Lisette Asiu | D71: DNI | E71: 41812084 | F71: Tesorer¡a | G71: Sr.Novoa | I71: 15.58
A72: =(A71+1) -> 67 | B72: 15.56 | C72: Herbert Zuñiga | D72: DNI | E72: 29306639 | F72: Abastecimient | G72: Sr.La Torre | I72: 16.02
A73: =(A72+1) -> 68 | B73: 16.00 | C73: Juan Enciso | D73: DNI | E73: 07246714 | F73: Visita | G73: Dr. Juan Baustista Bardelli Lartirigoyen | I73: 17.00
A74: =(A73+1) -> 69 | B74: 16.05 | C74: Jorge Aliaga | D74: DNI | E74: 06782356 | F74: Visita | G74: Dr. Juan Baustista Bardelli Lartirigoyen | I74: 16.25
A75: =(A74+1) -> 70 | B75: 16.09 | C75: María Dragg | D75: DNI | E75: 25796182 | F75: G.General | G75: Dr. Oscar del Rio | I75: 16.07
A76: =(A75+1) -> 71 | B76: 16.11 | C76: Alonso González | D76: DNI | E76: 07436225 | F76: Abastecimient | G76: Sr. Jorge Borda | I76: 16.40
A77: =(A76+1) -> 72 | B77: 16.17 | C77: Germán Larrieu | D77: DNI | E77: 07775027 | F77: Visita | G77: Dr. César Landa Arroyo | I77: 16.33
A78: =(A77+1) -> 73 | B78: 16.18 | C78: Gilberto Varillas | D78: DNI | E78: 06856851 | F78: Abastecimient | G78: Sr. Jorge Borda | I78: 16.34
A79: =(A78+1) -> 74 | B79: 16.21 | C79: Jorge Delgado | D79: DNI | E79: 09532294 | F79: G.General | G79: Dr. Oscar del Rio | I79: 17.28
A80: =(A79+1) -> 75 | B80: 16.29 | C80: Felix Jurado | D80: DNI | E80: 07614867 | F80: Visita | G80: Dr. César Landa Arroyo | I80: 16.38
A81: =(A80+1) -> 76 | B81: 16.29 | C81: Eduardo Romani | D81: DNI | E81: 10316695 | F81: Visita | G81: Dr. César Landa Arroyo | I81: 16.38
A82: =(A81+1) -> 77 | B82: 16.29 | C82: Bernardino Romani | D82: DNI | E82: 07275044 | F82: Visita | G82: Dr. César Landa Arroyo | I82: 16.38
A83: =(A82+1) -> 78 | B83: 16.38 | C83: Raúl Obregon | D83: DNI | E83: 07847804 | F83: Abastecimient | G83: Sr. Jorge Borda | I83: 17.22
A84: =(A83+1) -> 79 | B84: 16.40 | C84: Olga Solorzano | D84: DNI | E84: 07216516 | F84: Abastecimient | G84: Sr. Jorge Borda | I84: 17.20
A85: =(A84+1) -> 80 | B85: 16.42 | C85: Lucinda Sedano | D85: DNI | E85: 08230213 | F85: Personal | G85: Sr.Ramos | I85: 16.55
A86: =(A85+1) -> 81 | B86: 16.42 | C86: Tomas Tello | D86: DNI | E86: 06020403 | F86: Personal | G86: Sr.Ramos | I86: 16.58
A87: =(A86+1) -> 82 | B87: 16.44 | C87: Manuel Alva | D87: DNI | E87: 18839650 | F87: Sec.General | G87: Dr. Carlos Pelaez Camacho | I87: 17.42
A88: =(A87+1) -> 83 | B88: 17.23 | C88: Rene Salcedo | D88: DNI | E88: 06234921 | F88: Sec.General | G88: Dr. Carlos Pelaez Camacho | I88: 17.32
A89: =(A88+1) -> 84 | B89: 17.32 | C89: Silvia Metzger | D89: DNI | E89: 08571918 | F89: G.General | G89: Dr. Oscar del Rio | I89: 19.20
A90: =(A89+1) -> 85 | B90: 17.49 | C90: Jesús Magallanes | D90: DNI | E90: 40216312 | F90: Visita | G90: Dr. R.Rodriguez | I90: 18.06
A91: =(A90+1) -> 86 | B91: 17.58 | C91: Francisco Quezada | D91: DNI | E91: 07833848 | F91: Abastecimient | G91: Sr. Jorge Borda | I91: 18.06