A2: Tribunal Constitucional
A3: 38544
A5: N. Vis. | B5: H. Ing. | C5: Visitante | D5: T. Doc. | E5: N. Doc. | F5: Razón Visita | G5: Persona Visitada | H5: Observaciones | I5: H.Sal.
A6: 1 | B6: 08.00 | C6: Roxana Cortina | D6: DNI | E6: 40697886 | F6: Practicante | G6: Dra.De Los Ríos
A7: =(A6+1) -> 2 | B7: 08.30 | C7: Mercedez Vasquez | D7: DNI | E7: 08194328 | F7: Presidencia | G7: Presidencia | I7: 08.42
A8: =(A7+1) -> 3 | B8: 08.30 | C8: Gloria Micheli | D8: DNI | E8: 07589189 | F8: Presidencia | G8: Presidencia | I8: 08.42
A9: =(A8+1) -> 4 | B9: 08.30 | C9: Orfelina Guerra | D9: DNI | E9: 08557373 | F9: Presidencia | G9: Presidencia | I9: 08.42
A10: =(A9+1) -> 5 | B10: 08.30 | C10: Ursula Mariñas | D10: DNI | E10: 08699030 | F10: Presidencia | G10: Presidencia | I10: 08.43
A11: =(A10+1) -> 6 | B11: 08.30 | C11: Consuelo Avila | D11: DNI | E11: 06740969 | F11: Presidencia | G11: Presidencia | I11: 08.43
A12: =(A11+1) -> 7 | B12: 08.30 | C12: Vilma Ponce | D12: DNI | E12: 07188145 | F12: Presidencia | G12: Presidencia | I12: 08.43
A13: =(A12+1) -> 8 | B13: 08.30 | C13: Nidia Ramirez | D13: DNI | E13: 06199753 | F13: Presidencia | G13: Presidencia | I13: 08.43
A14: =(A13+1) -> 9 | B14: 08.30 | C14: Clara Sandoval | D14: DNI | E14: 07332309 | F14: Presidencia | G14: Presidencia | I14: 08.43
A15: =(A14+1) -> 10 | B15: 08.51 | C15: Doris Díaz | D15: DNI | F15: Destacada | G15: Bienestar | I15: 12.58
A16: =(A15+1) -> 11 | B16: 08.53 | C16: Hugo Valverde | D16: DNI | E16: 06477057 | F16: Visita | G16: Dr. Victor Garcia Toma | I16: 09.39
A17: =(A16+1) -> 12 | B17: 08.54 | C17: Ernesto Trujillo | D17: DNI | E17: 41228265 | F17: Of.Informatic | G17: Ing. Rodriguez | H17: Practicante | I17: 13.40
A18: =(A17+1) -> 13 | B18: 09.00 | C18: Ivonne Rojas | D18: DNI | E18: 06140498 | F18: Asesores | G18: Asesores | H18: Refrigerio | I18: 11.37
A19: =(A18+1) -> 14 | B19: 09.24 | C19: Alicia Leon | D19: DNI | E19: 07791741 | F19: G.General | G19: Dr. Oscar del Rio | I19: 10.05
A20: =(A19+1) -> 15 | B20: 09.39 | C20: Ricardo Delgado | D20: DNI | E20: 09538832 | F20: Visita | G20: Dr. Victor Garcia Toma | I20: 09.48
A21: =(A20+1) -> 16 | B21: 09.39 | C21: Hugo Garcia S. | D21: DNI | E21: 07916293 | F21: Visita | G21: Dr. Victor Garcia Toma | I21: 09.48
A22: =(A21+1) -> 17 | B22: 09.44 | C22: Lucia Mendoza | D22: DNI | E22: 09159467 | F22: Tesorer¡a | G22: Sr.Novoa | I22: 09.51
A23: =(A22+1) -> 18 | B23: 10.07 | C23: Alicia Leon | D23: DNI | E23: 07791741 | F23: Bienestar | G23: Dra.Doris Díaz | I23: 10.18
A24: =(A23+1) -> 19 | B24: 10.17 | C24: Luis Namuche | D24: DNI | E24: 02898040 | F24: Abastecimient | G24: Sr. Jorge Borda | I24: 10.19
A25: =(A24+1) -> 20 | B25: 10.22 | C25: María González | D25: DNI | E25: 09779771 | F25: Bienestar | G25: Dra.Doris Díaz | I25: 11.37
A26: =(A25+1) -> 21 | B26: 10.35 | C26: José Garay | D26: DNI | E26: 20075934 | F26: Of.Personal | G26: Sra.Ordoñez | I26: 10.43
A27: =(A26+1) -> 22 | B27: 10.35 | C27: Luis Davila | D27: DNI | E27: 40151528 | F27: Of.Personal | G27: Sra.Ordoñez | I27: 10.43
A28: =(A27+1) -> 23 | B28: 10.54 | C28: Carlos Corro | D28: DNI | E28: 06249288 | F28: Serpost | G28: OTDA | I28: 11.40
A29: =(A28+1) -> 24 | B29: 11.18 | C29: Raúl Dueñas | D29: DNI | E29: 10129749 | F29: Visita | G29: Dr. Victor Garcia Toma | I29: 11.30
A30: =(A29+1) -> 25 | B30: 11.29 | C30: Domingo Garcia | D30: DNI | E30: 08216016 | F30: Visita | G30: Dr. Magdiel Gonzales Ojeda | I30: 12.12
A31: =(A30+1) -> 26 | B31: 11.40 | C31: Amadeo Morena | D31: DNI | E31: 04744589 | F31: Presidencia | G31: Presidencia | I31: 12.03
A32: =(A31+1) -> 27 | B32: 12.10 | C32: Hernán Yaipen | D32: DNI | E32: 08054764 | F32: Visita | G32: Dr. Magdiel Gonzales Ojeda | I32: 13.42
A33: =(A32+1) -> 28 | B33: 12.27 | C33: Sepiriano Grimaldo | D33: DNI | E33: 10535965 | F33: Abastecimient | G33: Sr. Jorge Borda | I33: 13.15
A34: =(A33+1) -> 29 | B34: 12.35 | C34: Teresa González | D34: DNI | E34: 07938078 | F34: Visita | G34: Dr. Magdiel Gonzales Ojeda | I34: 12.46
A35: =(A34+1) -> 30 | B35: 12.35 | C35: Víctor Livia | D35: DNI | E35: 09671923 | F35: Visita | G35: Dr. Magdiel Gonzales Ojeda | I35: 12.46
A36: =(A35+1) -> 31 | B36: 12.36 | C36: Guillermo Sevilla | D36: DNI | E36: 06161974 | F36: Visita | G36: Dr. Juan Vergara Gotelli | I36: 14.14
A37: =(A36+1) -> 32 | B37: 13.00 | C37: Luz Bedon | D37: DNI | E37: 44009675 | F37: Asesores | G37: Asesora | H37: Refrigerio | I37: 13.30
A38: =(A37+1) -> 33 | B38: 13.02 | C38: Digna Carhuallanqui | D38: DNI | E38: 01983120 | F38: Asesores | G38: Dra.Rosado | H38: Refrigerio | I38: 13.32
A39: =(A38+1) -> 34 | B39: 14.16 | C39: Christian Apolo | D39: DNI | E39: 02867674 | F39: Auditoria | G39: Sra. P.Diaz | I39: 14.32
A40: =(A39+1) -> 35 | B40: 14.16 | C40: Arnaldo Sotelo | D40: DNI | E40: 40606413 | F40: Auditoria | G40: Sra.P.Diaz | I40: 14.32
A41: =(A40+1) -> 36 | B41: 14.51 | C41: Edgar Salas | D41: DNI | E41: 08085085 | F41: Abastecimient | G41: Sr. Jorge Borda | I41: 15.05
A42: =(A41+1) -> 37 | B42: 15.02 | C42: Rosa Ludin | D42: DNI | E42: 00240781 | F42: Abastecimient | G42: Sr. Jorge Borda | I42: 18.30
A43: =(A42+1) -> 38 | B43: 15.02 | C43: Reyna Pizarro | D43: DNI | E43: 02065949 | F43: Abastecimient | G43: Sr. Jorge Borda | I43: 18.30
A44: =(A43+1) -> 39 | B44: 15.02 | C44: Guillermina Pineda | D44: DNI | E44: 06129283 | F44: Abastecimient | G44: Sr. Jorge Borda | I44: 18.30
A45: =(A44+1) -> 40 | B45: 15.02 | C45: Elcira GuinetA | D45: DNI | E45: 07189508 | F45: Abastecimient | G45: Sr. Jorge Borda | I45: 18.30
A46: =(A45+1) -> 41 | B46: 15.02 | C46: Ildaura Manrique | D46: DNI | E46: 07836095 | F46: Abastecimient | G46: Sr. Jorge Borda | I46: 18.30
A47: =(A46+1) -> 42 | B47: 15.10 | C47: Gustavo López | D47: DNI | E47: 06666705 | F47: Visita | G47: Dr. Magdiel Gonzales Ojeda | I47: 15.25
A48: =(A47+1) -> 43 | B48: 15.10 | C48: Lupe Rodríguez | D48: DNI | E48: 09643464 | F48: Visita | G48: Dr. César Landa Arroyo | I48: 15.12
A49: =(A48+1) -> 44 | B49: 15.14 | C49: Fabiola Rodríguez | D49: DNI | E49: 07494713 | F49: Abastecimient | G49: Sr. Jorge Borda | I49: 16.53
A50: =(A49+1) -> 45 | B50: 15.14 | C50: Marina Viera | D50: DNI | E50: 08963837 | F50: Abastecimient | G50: Sr. Jorge Borda | I50: 16.53
A51: =(A50+1) -> 46 | B51: 15.16 | C51: Miguel Seminario | D51: DNI | E51: 40501669 | F51: Abastecimient | G51: Sr. Jorge Borda | I51: 15.20
A52: =(A51+1) -> 47 | B52: 15.24 | C52: Fernando Peña | D52: DNI | E52: 06069781 | F52: Abastecimient | G52: Sr. Jorge Borda | I52: 15.40
A53: =(A52+1) -> 48 | B53: 15.35 | C53: Edison Ledesma | D53: DNI | E53: 10409792 | F53: G.General | G53: Dr. Oscar del Rio | I53: 16.00
A54: =(A53+1) -> 49 | B54: 15.45 | C54: Pelayo Rojas | D54: DNI | E54: 09958067 | F54: Personal | G54: Srta.P.Rojas | I54: 15.47
A55: =(A54+1) -> 50 | B55: 16.25 | C55: Tomas Tello | D55: DNI | E55: 06020408 | F55: Presidencia | G55: Sra.Walters | I55: 16.30
A56: =(A55+1) -> 51 | B56: 16.27 | C56: Moisés Gutiérrez | D56: DNI | E56: 08177544 | F56: Personal | G56: Sra.Ordoñez | I56: 16.29
A57: =(A56+1) -> 52 | B57: 16.27 | C57: Hector Pérez | D57: DNI | E57: 09188611 | F57: Personal | G57: Sra.Ordoñez | I57: 16.29
A58: =(A57+1) -> 53 | B58: 16.35 | C58: María Cabañas | D58: DNI | E58: 07413962 | F58: Silsa | G58: Silsa | I58: 17.02
A59: =(A58+1) -> 54 | B59: 16.40 | C59: José L.Mendoza | D59: DNI | E59: 16626737 | F59: Abastecimient | G59: Sr. Jorge Borda | I59: 16.53
A60: =(A59+1) -> 55 | B60: 17.00 | C60: Jorge Zegarra | D60: DNI | E60: 07975161 | F60: Tesorería | G60: Sr.Novoa | I60: 17.10
A61: =(A60+1) -> 56 | B61: 17.02 | C61: Doris Díaz | D61: DNI | F61: Destacada | G61: Bienestar | I61: 17.15