A2: Tribunal Constitucional
A3: 38540
A5: N. Vis. | B5: H. Ing. | C5: Visitante | D5: T. Doc. | E5: N. Doc. | F5: Razón Visita | G5: Persona Visitada | H5: Observaciones | I5: H.Sal.
A6: 1 | B6: 08.15 | C6: Jorge Bicerra | D6: DNI | E6: 00032454 | F6: Entrevista | G6: Presidencia | I6: 08.22
A7: =(A6+1) -> 2 | B7: 08.15 | C7: Erasmo Torrejón | D7: DNI | E7: 40399827 | F7: Entrevista | G7: Presidencia | I7: 08.22
A8: =(A7+1) -> 3 | B8: 08.15 | C8: Rosa Tenorio | D8: DNI | E8: 06718897 | F8: Entrevista | G8: Presidencia | I8: 08.22
A9: =(A8+1) -> 4 | B9: 08.15 | C9: Luis Alfaro | D9: DNI | E9: 25836381 | F9: Entrevista | G9: Presidencia | I9: 08.22
A10: =(A9+1) -> 5 | B10: 08.15 | C10: Carlos Villalobos | D10: DNI | E10: 16698894 | F10: Entrevista | G10: Presidencia | I10: 08.22
A11: =(A10+1) -> 6 | B11: 08.15 | C11: Carlos Chirinos | D11: DNI | E11: 09536684 | F11: Entrevista | G11: Presidencia | I11: 08.22
A12: =(A11+1) -> 7 | B12: 08.15 | C12: Juan Motta | D12: DNI | E12: 28813127 | F12: Entrevista | G12: Presidencia | I12: 08.22
A13: =(A12+1) -> 8 | B13: 08.15 | C13: Margarita Gil | D13: DNI | E13: 07802941 | F13: Entrevista | G13: Presidencia | I13: 08.22
A14: =(A13+1) -> 9 | B14: 08.15 | C14: Servando Pérez | D14: DNI | E14: 09389048 | F14: Entrevista | G14: Presidencia | I14: 08.22
A15: =(A14+1) -> 10 | B15: 08.15 | C15: José Díaz | D15: DNI | E15: 25641991 | F15: Entrevista | G15: Presidencia | I15: 08.22
A16: =(A15+1) -> 11 | B16: 08.20 | C16: Maximiliano Nuñez | D16: DNI | E16: 10510195 | F16: Entrevista | G16: Presidencia | I16: 08.23
A17: =(A16+1) -> 12 | B17: 08.20 | C17: Elías Bautista | D17: DNI | E17: 06164408 | F17: Entrevista | G17: Presidencia | I17: 08.23
A18: =(A17+1) -> 13 | B18: 08.20 | C18: Genaro Torres | D18: DNI | E18: 06210822 | F18: Entrevista | G18: Presidencia | I18: 08.23
A19: =(A18+1) -> 14 | B19: 08.20 | C19: Cesar Falcon | D19: DNI | E19: 06839148 | F19: Entrevista | G19: Presidencia | I19: 08.23
A20: =(A19+1) -> 15 | B20: 08.20 | C20: Juan Fernández | D20: DNI | E20: 09903327 | F20: Entrevista | G20: Presidencia | I20: 08.23
A21: =(A20+1) -> 16 | B21: 08.20 | C21: Saturnino Luis | D21: DNI | E21: 04026410 | F21: Entrevista | G21: Presidencia | I21: 08.23
A22: =(A21+1) -> 17 | B22: 08.20 | C22: María Chaviguri | D22: DNI | E22: 10285406 | F22: Visita | G22: Dr. Juan Vergara Gotelli | I22: 09.46
A23: =(A22+1) -> 18 | B23: 08.20 | C23: Robert Romero | D23: DNI | E23: 01327376 | F23: Entrevista | G23: Presidencia | I23: 08.23
A24: =(A23+1) -> 19 | B24: 08.25 | C24: Manuel Aquino | D24: DNI | E24: 06860925 | F24: Entrevista | G24: Presidencia | I24: 08.30
A25: =(A24+1) -> 20 | B25: 08.25 | C25: Fortunato Ccente | D25: DNI | E25: 23241284 | F25: Entrevista | G25: Presidencia | I25: 08.30
A26: =(A25+1) -> 21 | B26: 08.25 | C26: Antonio Yabar | D26: DNI | E26: 10183191 | F26: Entrevista | G26: Presidencia | I26: 08.30
A27: =(A26+1) -> 22 | B27: 08.25 | C27: Juan Santana | D27: DNI | E27: 21250460 | F27: Entrevista | G27: Presidencia | I27: 08.30
A28: =(A27+1) -> 23 | B28: 08.25 | C28: Juan Churampi | D28: DNI | E28: 21250705 | F28: Entrevista | G28: Presidencia | I28: 08.30
A29: =(A28+1) -> 24 | B29: 08.25 | C29: Rosa Zamora | D29: DNI | E29: 06002240 | F29: Entrevista | G29: Presidencia | I29: 08.30
A30: =(A29+1) -> 25 | B30: 08.25 | C30: Edgar Aparicio | D30: DNI | E30: 15399048 | F30: Entrevista | G30: Presidencia | I30: 08.30
A31: =(A30+1) -> 26 | B31: 08.25 | C31: Rene Vargas | D31: DNI | E31: 08052931 | F31: Entrevista | G31: Presidencia | I31: 08.30
A32: =(A31+1) -> 27 | B32: 08.25 | C32: Higinio Añasco | D32: DNI | E32: 92313541 | F32: Entrevista | G32: Presidencia | I32: 08.30
A33: =(A32+1) -> 28 | B33: 08.25 | C33: Carlos Contreras | D33: DNI | E33: 09400048 | F33: Entrevista | G33: Presidencia | I33: 08.30
A34: =(A33+1) -> 29 | B34: 08.30 | C34: Guillermo Aranda | D34: DNI | E34: 07443568 | F34: Entrevista | G34: Presidencia | I34: 08.34
A35: =(A34+1) -> 30 | B35: 08.30 | C35: Abad Tello | D35: DNI | E35: 09238402 | F35: Entrevista | G35: Presidencia | I35: 08.34
A36: =(A35+1) -> 31 | B36: 08.30 | C36: Wilder Quispe | D36: DNI | E36: 04063086 | F36: Entrevista | G36: Presidencia | I36: 08.34
A37: =(A36+1) -> 32 | B37: 08.30 | C37: José Medina | D37: DNI | E37: 08886915 | F37: Entrevista | G37: Presidencia | I37: 08.34
A38: =(A37+1) -> 33 | B38: 08.30 | C38: Manuel Espinoza | D38: DNI | E38: 06758906 | F38: Entrevista | G38: Presidencia | I38: 08.34
A39: =(A38+1) -> 34 | B39: 08.30 | C39: Soledad Avila | D39: DNI | E39: 08825046 | F39: Entrevista | G39: Presidencia | I39: 08.34
A40: =(A39+1) -> 35 | B40: 08.30 | C40: Janet Avila | D40: DNI | E40: 41743602 | F40: Entrevista | G40: Presidencia | I40: 08.34
A41: =(A40+1) -> 36 | B41: 08.36 | C41: Marco Gaspar | D41: DNI | E41: 08810957 | F41: Entrevista | G41: Presidencia | I41: 08.38
A42: =(A41+1) -> 37 | B42: 08.36 | C42: Raúl Abarca | D42: DNI | E42: 07700622 | F42: Entrevista | G42: Presidencia | I42: 08.38
A43: =(A42+1) -> 38 | B43: 08.36 | C43: Ana Guzmán | D43: DNI | E43: 06783517 | F43: Entrevista | G43: Presidencia | I43: 08.38
A44: =(A43+1) -> 39 | B44: 08.36 | C44: Víctor De La Cruz | D44: DNI | E44: 41034248 | F44: Entrevista | G44: Presidencia | I44: 08.38
A45: =(A44+1) -> 40 | B45: 08.36 | C45: Carlos Cueva | D45: DNI | E45: 07211572 | F45: Entrevista | G45: Presidencia | I45: 08.38
A46: =(A45+1) -> 41 | B46: 08.36 | C46: Víctor Gómez | D46: DNI | E46: 09997086 | F46: Entrevista | G46: Presidencia | I46: 08.38
A47: =(A46+1) -> 42 | B47: 08.36 | C47: Evin Querevalu | D47: DNI | E47: 17451908 | F47: Entrevista | G47: Presidencia | I47: 08.38
A48: =(A47+1) -> 43 | B48: 08.36 | C48: Gilberto Baca | D48: DNI | E48: 09426530 | F48: Entrevista | G48: Presidencia | I48: 08.38
A49: =(A48+1) -> 44 | B49: 08.36 | C49: Julio Mendoza | D49: DNI | E49: 10480373 | F49: Entrevista | G49: Presidencia | I49: 08.38
A50: =(A49+1) -> 45 | B50: 08.36 | C50: Roberto Melendez | D50: DNI | E50: 21487382 | F50: Entrevista | G50: Presidencia | I50: 08.38
A51: =(A50+1) -> 46 | B51: 09.00 | C51: Luz Bedon | D51: DNI | E51: 44009675 | F51: Asesores | G51: Dra. Milagriros Landa | H51: Desayuno | I51: 09.30
A52: =(A51+1) -> 47 | B52: 09.00 | C52: Ivonne Rojas | D52: DNI | E52: 06140498 | F52: Asesores | G52: Asesores | H52: Refrigerio | I52: 10.40
A53: =(A52+1) -> 48 | B53: 09.18 | C53: Juan Monroy | D53: DNI | E53: 07571335 | F53: Visita | G53: Dr. Magdiel Gonzales Ojeda | I53: 09.20
A54: =(A53+1) -> 49 | B54: 09.32 | C54: David Domínguez | D54: DNI | E54: 43224284 | F54: Asesor Legal | G54: Dr.Dumet | I54: 09.42
A55: =(A54+1) -> 50 | B55: 09.48 | C55: Doris Díaz | D55: DNI | F55: Destacada | G55: Bienestar | I55: 16.00
A56: =(A55+1) -> 51 | B56: 09.59 | C56: José L.Armestar | D56: DNI | E56: 07090005 | F56: Serpost | G56: OTDA | I56: 13.47
A57: =(A56+1) -> 52 | B57: 10.22 | C57: Delmira Cardenas | D57: DNI | E57: 31120657 | F57: Bienestar | G57: Dra.Doris Díaz | I57: 10.52
A58: =(A57+1) -> 53 | B58: 10.29 | C58: Gladys Nuñez | D58: DNI | E58: 51020265 | F58: Abastecimient | G58: Sr. Jorge Borda | I58: 10.30
A59: =(A58+1) -> 54 | B59: 10.48 | C59: Giusseppi Higinio | D59: DNI | E59: 41907515 | F59: Auditoria | G59: Ing.Espinoza | I59: 16.56
A60: =(A59+1) -> 55 | B60: 11.29 | C60: Americo Arana | D60: DNI | E60: 07341905 | F60: Bienestar | G60: Dra.Doris Díaz | I60: 11.41
A61: =(A60+1) -> 56 | B61: 11.32 | C61: Felix Crespin | D61: DNI | E61: 32805542 | F61: R.R.P.P. | G61: Sr.Rojas | I61: 11.35
A62: =(A61+1) -> 57 | B62: 11.32 | C62: Víctor Romero | D62: DNI | E62: 06155462 | F62: R.R.P.P. | G62: Sr.Rojas | I62: 11.35
A63: =(A62+1) -> 58 | B63: 11.34 | C63: Wilder Chavez | D63: DNI | E63: 09461997 | F63: Tesorer¡a | G63: Sr.Novoa | I63: 11.45
A64: =(A63+1) -> 59 | B64: 11.34 | C64: Carlos Fernández | D64: DNI | E64: 30173272 | F64: Tesorer¡a | G64: Sr.Novoa | I64: 11.45
A65: =(A64+1) -> 60 | B65: 11.36 | C65: Manuel Oneto | D65: DNI | E65: 08262179 | F65: Abastecimient | G65: Sr.La Torre | I65: 11.38
A66: =(A65+1) -> 61 | B66: 11.51 | C66: Juan Pardo | D66: DNI | E66: 08122665 | F66: Visita | G66: Sra. Ferreyros | I66: 12.18
A67: =(A66+1) -> 62 | B67: 12.00 | C67: Ana P.Bardelli | D67: DNI | F67: Visita | G67: Dr. Juan Baustista Bardelli Lartirigoyen | I67: 12.45
A68: =(A67+1) -> 63 | B68: 12.15 | C68: Mirían Ordinola | D68: DNI | E68: 07608711 | F68: Cedij | G68: Sr.F.Reategui | I68: 12.19
A69: =(A68+1) -> 64 | B69: 12.37 | C69: María Morales | D69: DNI | E69: 07880181 | F69: Bienestar | G69: Dra.Doris Díaz | I69: 15.26
A70: =(A69+1) -> 65 | B70: 12.38 | C70: Luz Bedon | D70: DNI | E70: 44009675 | F70: Secretaria General | G70: Sra.Quezada | H70: Refrigerio | I70: 13.30
A71: =(A70+1) -> 66 | B71: 12.49 | C71: Francisco Quezada | D71: DNI | E71: 07833848 | F71: Abastecimient | G71: Sr. Jorge Borda | I71: 13.00
A72: =(A71+1) -> 67 | B72: 12.49 | C72: Gladis Kalencaunsky | D72: DNI | E72: 07830479 | F72: Abastecimient | G72: Sr. Jorge Borda | I72: 13.18
A73: =(A72+1) -> 68 | B73: 13.18 | C73: Digna Carhuallanqui | D73: DNI | E73: 19838120 | F73: Asesores | G73: Dra.Rosado | H73: Refrigerio | I73: 14.10
A74: =(A73+1) -> 69 | B74: 14.21 | C74: Ernesto Trujillo | D74: DNI | E74: 41228265 | F74: Of.Informatic | G74: Ing. Rodriguez | H74: Practicante | I74: 18.00
A75: =(A74+1) -> 70 | B75: 14.55 | C75: Juan Huanca | D75: DNI | E75: 29628069 | F75: Tesorer¡a | G75: Sr.Sandoval | I75: 14.59
A76: =(A75+1) -> 71 | B76: 14.57 | C76: Ana M.Obregon | D76: DNI | E76: 06189367 | F76: Personal | G76: Sr.Ramos | I76: 15.47
A77: =(A76+1) -> 72 | B77: 15.06 | C77: Fabiola Rodríguez | D77: DNI | E77: 07494713 | F77: Abastecimient | G77: Sr. Jorge Borda | I77: 17.11
A78: =(A77+1) -> 73 | B78: 15.06 | C78: Marino Viera | D78: DNI | E78: 08962837 | F78: Abastecimient | G78: Sr. Jorge Borda | I78: 17.11
A79: =(A78+1) -> 74 | B79: 15.06 | C79: Jaime Ayña | D79: DNI | E79: 42888906 | F79: Abastecimient | G79: Sr. Jorge Borda | I79: 17.11
A80: =(A79+1) -> 75 | B80: 15.10 | C80: Alejandro Carlos | D80: DNI | E80: 04204083 | F80: Abastecimient | G80: Sr. Jorge Borda | I80: 15.47
A81: =(A80+1) -> 76 | B81: 15.10 | C81: Rosa Rivera | D81: DNI | E81: 07958663 | F81: Abastecimient | G81: Sr. Jorge Borda | I81: 15.47
A82: =(A81+1) -> 77 | B82: 15.10 | C82: Azucena Garay | D82: DNI | E82: 08507068 | F82: Abastecimient | G82: Sra.Linares | I82: 15.47
A83: =(A82+1) -> 78 | B83: 15.12 | C83: Clotilde Aranda | D83: DNI | E83: 10427229 | F83: Personal | G83: Sra.Ordoñez | I83: 15.48
A84: =(A83+1) -> 79 | B84: 15.21 | C84: Ivan Sánchez | D84: DNI | E84: 06651298 | F84: Bienestar | G84: Dra.Doris Díaz | I84: 16.04
A85: =(A84+1) -> 80 | B85: 15.31 | C85: John Mogollón | D85: DNI | E85: 09243380 | F85: Personal | G85: Sr.Ramos | I85: 15.38
A86: =(A85+1) -> 81 | B86: 15.49 | C86: Lidia Aldazabal | D86: DNI | E86: 09484020 | F86: Bienestar | G86: Dra.Doris Díaz | I86: 15.56
A87: =(A86+1) -> 82 | B87: 16.15 | C87: Eugenio López | D87: DNI | E87: 42355314 | F87: Visita | G87: Dr. Melendez | I87: 16.35
A88: =(A87+1) -> 83 | B88: 16.20 | C88: Tomas Tello | D88: DNI | E88: 06020403 | F88: Tesorer¡a | G88: Sr.Novoa | I88: 16.33
A89: =(A88+1) -> 84 | B89: 16.40 | C89: Delmira Cardenas | D89: DNI | E89: 31120657 | F89: Bienestar | G89: Dra.Doris Díaz | I89: 16.54
A90: =(A89+1) -> 85 | B90: 16.49 | C90: Cesar Rivarola | D90: DNI | E90: 06644287 | F90: Visita | G90: Dr. Juan Baustista Bardelli Lartirigoyen | I90: 17.03
A91: =(A90+1) -> 86 | B91: 16.48 | C91: Robinson Ocampo | D91: DNI | E91: 10684463 | F91: R.R.P.P. | G91: Sr.Rojas | I91: 17.04
A92: =(A91+1) -> 87 | B92: 16.49 | C92: Jesús Magallanes | D92: DNI | E92: 40216312 | F92: Visita | G92: Dra. Valencia | I92: 17.08
A93: =(A92+1) -> 88 | B93: 16.52 | C93: José Noroña | D93: DNI | E93: 06257703 | F93: Personal | G93: Sr.Ramos | I93: 18.50
A94: =(A93+1) -> 89 | B94: 17.39 | C94: David Montoya | D94: DNI | E94: 08055756 | F94: Sec.General | G94: Dr. Carlos Pelaez Camacho | I94: 17.41