A2: Tribunal Constitucional
A3: 38537
A5: N. Vis. | B5: H. Ing. | C5: Visitante | D5: T. Doc. | E5: N. Doc. | F5: Razón Visita | G5: Persona Visitada | H5: Observaciones | I5: H.Sal.
A6: 1 | B6: 08.20 | C6: Daniel Lozada | D6: DNI | E6: 29486004 | F6: Presidencia | G6: Presidencia | I6: 08.26
A7: =(A6+1) -> 2 | B7: 08.20 | C7: Edgard Cayoutpa | D7: DNI | E7: 27423695 | F7: Presidencia | G7: Presidencia | I7: 08.53
A8: =(A7+1) -> 3 | B8: 08.29 | C8: Dorian Talavera | D8: DNI | E8: 08716282 | F8: Visita | G8: Dr. Juan Vergara Gotelli | I8: 08.55
A9: =(A8+1) -> 4 | B9: 08.29 | C9: Carlos Caceres | D9: DNI | E9: 09144350 | F9: Visita | G9: Dr. Juan Vergara Gotelli | I9: 08.40
A10: =(A9+1) -> 5 | B10: 08.29 | C10: Benjamin Enriquez | D10: DNI | E10: 09150098 | F10: Visita | G10: Dr. Juan Vergara Gotelli | I10: 08.55
A11: =(A10+1) -> 6 | B11: 08.32 | C11: Juan Pardo | D11: DNI | E11: 08122665 | F11: Visita | G11: Dr. M.Reategui | I11: 08.46
A12: =(A11+1) -> 7 | B12: 08.50 | C12: Guillermo Freund | D12: DNI | E12: 07967523 | F12: Visita | G12: Dra. Revoredo | I12: 11.08
A13: =(A12+1) -> 8 | B13: 08.51 | C13: Doris Diaz | D13: DNI | F13: Destacada | G13: Of.Bienestar | I13: 14.50
A14: =(A13+1) -> 9 | B14: 08.53 | C14: E.Trujillo | D14: DNI | E14: 41228265 | F14: Of.Informatic | G14: Ing. Rodriguez | H14: Practicante | I14: 17.36
A15: =(A14+1) -> 10 | B15: 08.53 | C15: Ivonne Rojas | D15: DNI | E15: 06140498 | F15: Asesores | G15: Asesores | H15: Refrigerio | I15: 11.10
A16: =(A15+1) -> 11 | B16: 09.10 | C16: Cesar Rodriguez | D16: DNI | E16: 42854422 | F16: Visita | G16: Dr. Juan Baustista Bardelli Lartirigoyen | I16: 10.17
A17: =(A16+1) -> 12 | B17: 09.19 | C17: Juan Pardo | D17: DNI | E17: 08122665 | F17: G.General | G17: Dr. Oscar del Rio Gonzales | I17: 09.21
A18: =(A17+1) -> 13 | B18: 10.02 | C18: Ricardo Sanchez | D18: DNI | E18: 07547897 | F18: Visita | G18: Dr. Victor Garcia Toma | I18: 10.15
A19: =(A18+1) -> 14 | B19: 10.02 | C19: Yuri Villanes | D19: DNI | E19: 09412347 | F19: Visita | G19: Dr. Victor Garcia Toma | I19: 10.15
A20: =(A19+1) -> 15 | B20: 10.02 | C20: Marcial Calderon | D20: DNI | E20: 06216308 | F20: Visita | G20: Dr. Victor Garcia Toma | I20: 10.15
A21: =(A20+1) -> 16 | B21: 10.04 | C21: Emik Tafur | D21: DNI | E21: 07561834 | F21: Personal | G21: Sra.Ordoñez | I21: 10.10
A22: =(A21+1) -> 17 | B22: 10.23 | C22: Jose Armestar | D22: DNI | E22: 07090005 | F22: Serpost | G22: OTDA | I22: 12.20
A23: =(A22+1) -> 18 | B23: 10.35 | C23: Jorge Bardelli | D23: DNI | F23: Visita | G23: Dr. Juan Baustista Bardelli Lartirigoyen | I23: 10.57
A24: =(A23+1) -> 19 | B24: 10.35 | C24: Javier Panduro | D24: DNI | E24: 00803206 | F24: Visita | G24: Dr. Juan Baustista Bardelli Lartirigoyen | I24: 10.57
A25: =(A24+1) -> 20 | B25: 11.02 | C25: Ana Maria Jara | D25: DNI | E25: 07217839 | F25: Bienestar | G25: Dra.Doris Diaz | I25: 11.17
A26: =(A25+1) -> 21 | B26: 11.09 | C26: Roberto Sevillano | D26: DNI | E26: 25827904 | F26: Bienestar | G26: Dra.Doris Diaz | I26: 11.17
A27: =(A26+1) -> 22 | B27: 11.09 | C27: Carlos Zedano | D27: DNI | E27: 41266274 | F27: Secre.General | G27: Dr. Carlos Pelaez Camacho | I27: 11.11
A28: =(A27+1) -> 23 | B28: 11.12 | C28: Fabrizio Franco | D28: DNI | E28: 06428479 | F28: Pnud | G28: PNUD | I28: 15.13
A29: =(A28+1) -> 24 | B29: 11.17 | C29: Luis Namuche | D29: DNI | E29: 02898040 | F29: Abastecimient | G29: Sr. Jorge Borda | I29: 11.19
A30: =(A29+1) -> 25 | B30: 11.23 | C30: Hans Panuera | D30: DNI | E30: 41120843 | F30: G.General | G30: Dr. Oscar del Rio Gonzales | I30: 11.25
A31: =(A30+1) -> 26 | B31: 11.40 | C31: Julio Orellano | D31: DNI | E31: 21404068 | F31: Abastecimient | G31: Sr. Jorge Borda | I31: 11.44
A32: =(A31+1) -> 27 | B32: 12.30 | C32: Maria Rivera | D32: DNI | E32: 07590645 | F32: Abastecimient | G32: Sr. Jorge Borda | I32: 12.35
A33: =(A32+1) -> 28 | B33: 12.43 | C33: Luz Bedon | D33: DNI | E33: 44009675 | F33: Secretarias | G33: Sra. E.Guevara | H33: Refrigerio | I33: 13.10
A34: =(A33+1) -> 29 | B34: 12.49 | C34: Braulio Grimaldo | D34: DNI | E34: 10289440 | F34: Abastecimient | G34: Sra.Linares | I34: 12.59
A35: =(A34+1) -> 30 | B35: 12.57 | C35: Raul Flores | D35: DNI | E35: 43582689 | F35: Asesores | G35: Dr.De la Puente | H35: Refrigerio | I35: 13.30
A36: =(A35+1) -> 31 | B36: 12.58 | C36: Digna Carhuallanqui | D36: DNI | E36: 19838120 | F36: Asesores | G36: Dra.Rosado | H36: Refrigerio | I36: 13.20
A37: =(A36+1) -> 32 | B37: 13.08 | C37: Leyla Cavero | D37: DNI | E37: 08005913 | F37: Visita | G37: Dr. Juan Vergara Gotelli | I37: 13.41
A38: =(A37+1) -> 33 | B38: 13.08 | C38: Lorena Bellina | D38: DNI | E38: 06627970 | F38: Visita | G38: Dr. Juan Vergara Gotelli | I38: 13.41
A39: =(A38+1) -> 34 | B39: 13.08 | C39: Fredy Otarola | D39: DNI | E39: 06453147 | F39: Visita | G39: Dr. Juan Vergara Gotelli | I39: 13.41
A40: =(A39+1) -> 35 | B40: 14.08 | C40: Stalin Mendoza | D40: DNI | E40: 15859262 | F40: Visita | G40: Dr. Juan Baustista Bardelli Lartirigoyen | I40: 14.33
A41: =(A40+1) -> 36 | B41: 14.50 | C41: Jesus Ramos | D41: DNI | E41: 19994631 | F41: Visita | G41: Dr. César Landa Arroyo | I41: 14.54
A42: =(A41+1) -> 37 | B42: 15.05 | C42: Pedro Espino | D42: DNI | E42: 07959972 | F42: Visita | G42: Dr. Juan Baustista Bardelli Lartirigoyen | I42: 15.08
A43: =(A42+1) -> 38 | B43: 15.08 | C43: Sandra Calderon | D43: DNI | E43: 40136317 | F43: Abastecimient | G43: Sr. Jorge Borda | I43: 15.10
A44: =(A43+1) -> 39 | B44: 15.09 | C44: Javier Rojas | D44: DNI | E44: 09873365 | F44: Tesoreria | G44: Sr.Novoa | I44: 15.19
A45: =(A44+1) -> 40 | B45: 15.54 | C45: Roxana Cortina | D45: DNI | E45: 09980805 | F45: Visita | G45: Dr. César Landa Arroyo | I45: 16.40
A46: =(A45+1) -> 41 | B46: 16.00 | C46: Guillermo Espinoza | D46: DNI | E46: 30500033 | F46: Tesoreria | G46: Sr.Novoa | I46: 16.03
A47: =(A46+1) -> 42 | B47: 16.02 | C47: Miguel Lozano | D47: DNI | E47: 09838670 | F47: Of.Informatic | G47: Ing. Rodriguez | I47: 16.32
A48: =(A47+1) -> 43 | B48: 16.06 | C48: Alberto Morales | D48: DNI | E48: 08049345 | F48: Abastecimient | G48: Sr. Jorge Borda | I48: 16.08
A49: =(A48+1) -> 44 | B49: 16.18 | C49: Andres Huamani | D49: DNI | E49: 06994409 | F49: Abastecimient | G49: Sr. Jorge Borda | I49: 16.29
A50: =(A49+1) -> 45 | B50: 16.25 | C50: Luis Alan R. | D50: DNI | E50: 08354456 | F50: Tesoreria | G50: Sr.Novoa | I50: 16.27
A51: =(A50+1) -> 46 | B51: 16.25 | C51: Robinson Ocampo | D51: DNI | E51: 10684463 | F51: G.General | G51: Dr. Oscar del Rio Gonzales | I51: 16.26
A52: =(A51+1) -> 47 | B52: 16.25 | C52: Jose L.Pastor | D52: DNI | E52: 09276071 | F52: Abastecimient | G52: Sr. Jorge Borda | I52: 18.05
A53: =(A52+1) -> 48 | B53: 16.32 | C53: Martin Nilupu | D53: DNI | E53: 03372296 | F53: Visita | G53: Dr. Victor Garcia Toma | I53: 16.58
A54: =(A53+1) -> 49 | B54: 16.43 | C54: Jorge Quiroz | D54: DNI | E54: 40939383 | F54: G.General | G54: Dr. Oscar del Rio Gonzales | I54: 16.54
A55: =(A54+1) -> 50 | B55: 16.51 | C55: Rodolfo Soto | D55: DNI | E55: 08274849 | F55: Abastecimient | G55: Sr. Jorge Borda | I55: 17.12
A56: =(A55+1) -> 51 | B56: 16.54 | C56: Oscar Giles | D56: DNI | E56: 08552394 | F56: Abastecimient | G56: Sr. Jorge Borda | I56: 16.55
A57: =(A56+1) -> 52 | B57: 17.00 | C57: Dante Gonzales | D57: DNI | E57: 10586228 | F57: Abastecimient | G57: Sr. Jorge Borda | I57: 17.15
A58: =(A57+1) -> 53 | B58: 17.07 | C58: Ronald Carhuas | D58: DNI | E58: 41880259 | F58: Of.Informatic | G58: Ing. Rodriguez | H58: Revisión de Impresora | I58: 18.29
A59: =(A58+1) -> 54 | B59: 17.07 | C59: Jorge Ramirez | D59: DNI | E59: 06158215 | F59: Abastecimient | G59: Sr. Jorge Borda | I59: 17.09
A60: =(A59+1) -> 55 | B60: 17.37 | C60: Luis Juarez | D60: DNI | E60: 08158844 | F60: G.General | G60: Dr. Oscar del Rio Gonzales | I60: 18.08
A61: =(A60+1) -> 56 | B61: 18.00 | C61: Rodolfo Soto | D61: DNI | E61: 08274849 | F61: Mantenimiento | G61: Sr.Rosales | I61: 18.16
A62: =(A61+1) -> 57 | B62: 18.00 | C62: Jaime Cabana | D62: DNI | E62: 09639882 | F62: Mantenimiento | G62: Sr.Rosales | I62: 18.16