A2: Tribunal Constitucional
A3: 38538
A5: N. Vis. | B5: H. Ing. | C5: Visitante | D5: T. Doc. | E5: N. Doc. | F5: Razón Visita | G5: Persona Visitada | H5: Observaciones | I5: H.Sal.
A6: 1 | B6: 08.17 | C6: Doris Díaz | D6: DNI | F6: Destacada | G6: Of.Bienestar | I6: 16.29
A7: =(A6+1) -> 2 | B7: 08.27 | C7: Andrés Roa | D7: DNI | E7: 41362558 | F7: Secre.General | G7: Dr. Carlos Pelaez Camacho | I7: 10.15
A8: =(A7+1) -> 3 | B8: 08.27 | C8: Carlos Artieda | D8: DNI | E8: 07206416 | F8: Secre.General | G8: Dr. Carlos Pelaez Camacho | I8: 10.15
A9: =(A8+1) -> 4 | B9: 08.29 | C9: Marcela Serruto | D9: DNI | E9: 07936456 | F9: Presidencia | G9: Presidencia | I9: 08.44
A10: =(A9+1) -> 5 | B10: 08.33 | C10: Fabrizio Franco | D10: DNI | E10: 06428479 | F10: Pnud | G10: PNUD | I10: 10.48
A11: =(A10+1) -> 6 | B11: 08.36 | C11: Jorge Chavez Sivina | D11: DNI | F11: Presidencia | G11: Presidencia | I11: 09.30
A12: =(A11+1) -> 7 | B12: 08.44 | C12: Tiburcio Pardo | D12: DNI | E12: 08173546 | F12: Abastecimient | G12: Sra.Linares | I12: 08.58
A13: =(A12+1) -> 8 | B13: 08.47 | C13: Edgard Cayotupa | D13: DNI | E13: 27423695 | F13: Presidencia | G13: Presidencia | I13: 10.00
A14: =(A13+1) -> 9 | B14: 08.48 | C14: Ernesto Trujillo | D14: DNI | E14: 41228265 | F14: Of.Informatic | G14: Ing. Rodriguez | H14: Practicante | I14: 13.10
A15: =(A14+1) -> 10 | B15: 08.55 | C15: Sergio Cordova | D15: DNI | E15: 09343587 | F15: Visita | G15: Dr. Juan Vergara Gotelli | I15: 09.22
A16: =(A15+1) -> 11 | B16: 09.06 | C16: Fredy Otarola | D16: DNI | E16: 06453147 | F16: Visita | G16: Dr. Juan Vergara Gotelli | I16: 09.46
A17: =(A16+1) -> 12 | B17: 09.17 | C17: José Arostegui | D17: DNI | E17: 06260395 | F17: Visita | G17: Dr. Victor Garcia Toma | I17: 09.56
A18: =(A17+1) -> 13 | B18: 09.19 | C18: Ivonne Rojas | D18: DNI | E18: 06140498 | F18: Asesores | G18: Asesores | H18: Refrigerio | I18: 11.30
A19: =(A18+1) -> 14 | B19: 09.20 | C19: Leyla Cavero | D19: DNI | E19: 08005913 | F19: Visita | G19: Dr. Juan Vergara Gotelli | I19: 09.46
A20: =(A19+1) -> 15 | B20: 09.20 | C20: Lorena Bellina | D20: DNI | E20: 06627970 | F20: Visita | G20: Dr. Juan Vergara Gotelli | I20: 09.46
A21: =(A20+1) -> 16 | B21: 09.32 | C21: Jorge Bardelli | D21: DNI | F21: Visita | G21: Dr. Juan Baustista Bardelli Lartirigoyen | I21: 09.45
A22: =(A21+1) -> 17 | B22: 09.36 | C22: Heli Montenegro | D22: DNI | E22: 03938869 | F22: Visita | G22: Dr. Juan Baustista Bardelli Lartirigoyen | I22: 10.34
A23: =(A22+1) -> 18 | B23: 09.50 | C23: Omar Mejorada | D23: DNI | E23: 15722171 | F23: Visita | G23: Dr. Victor Garcia Toma | I23: 10.10
A24: =(A23+1) -> 19 | B24: 10.02 | C24: Juan Enciso | D24: DNI | E24: 07246714 | F24: Visita | G24: Dr. Juan Baustista Bardelli Lartirigoyen | I24: 11.29
A25: =(A24+1) -> 20 | B25: 10.32 | C25: Jose L.Armestar | D25: DNI | E25: 07090005 | F25: Serpost | G25: OTDA | I25: 12.20
A26: =(A25+1) -> 21 | B26: 10.41 | C26: Dante González | D26: DNI | E26: 10586228 | F26: Vendomatica | G26: Abastecimiento | I26: 10.56
A27: =(A26+1) -> 22 | B27: 10.41 | C27: María Monteagudo | D27: DNI | E27: 10065431 | F27: Personal | G27: Sra.Ordoñez | I27: 10.52
A28: =(A27+1) -> 23 | B28: 10.49 | C28: Lorena Godoy | D28: DNI | E28: 15403256 | F28: Visita | G28: Dr. Juan Baustista Bardelli Lartirigoyen | I28: 12.05
A29: =(A28+1) -> 24 | B29: 10.52 | C29: Roque Pérez | D29: DNI | E29: 08900379 | F29: Visita | G29: Dr. Juan Baustista Bardelli Lartirigoyen | I29: 11.59
A30: =(A29+1) -> 25 | B30: 11.16 | C30: Mario Bardelli | D30: DNI | E30: 06407047 | F30: Visita | G30: Dr. Juan Baustista Bardelli Lartirigoyen | I30: 11.46
A31: =(A30+1) -> 26 | B31: 11.18 | C31: Richard Pimentel | D31: DNI | E31: 40197383 | F31: Abastecimient | G31: Sr. Jorge Borda | I31: 11.24
A32: =(A31+1) -> 27 | B32: 11.24 | C32: José L.Ucañay | D32: DNI | E32: 08046726 | F32: Abastecimient | G32: Sr. Jorge Borda | I32: 11.25
A33: =(A32+1) -> 28 | B33: 11.28 | C33: Andrés Callegari | D33: DNI | E33: 06482087 | F33: Presidencia | G33: Presidencia | I33: 11.48
A34: =(A33+1) -> 29 | B34: 11.28 | C34: Lucio Guirreonero | D34: DNI | E34: 08221528 | F34: Presidencia | G34: Presidencia | I34: 11.48
A35: =(A34+1) -> 30 | B35: 11.39 | C35: Augusto Cueto | D35: DNI | E35: 07234662 | F35: Tesorer¡a | G35: Sr.Novoa | I35: 11.44
A36: =(A35+1) -> 31 | B36: 11.42 | C36: Stalin Mendoza | D36: DNI | E36: 15859262 | F36: Visita | G36: Dr. Juan Baustista Bardelli Lartirigoyen | I36: 12.10
A37: =(A36+1) -> 32 | B37: 11.51 | C37: Gerardo Esto Cruz | D37: DNI | E37: 17802594 | F37: Visita | G37: Dr. Magdiel Gonzales Ojeda | I37: 12.07
A38: =(A37+1) -> 33 | B38: 11.53 | C38: Roberto Quijano | D38: DNI | E38: 09668160 | F38: Abastecimient | G38: Sr. Jorge Borda | I38: 12.14
A39: =(A38+1) -> 34 | B39: 12.03 | C39: Carmen Chambi | D39: DNI | E39: 07339900 | F39: Of.Bienestar | G39: Dra.Doris Diaz | I39: 12.40
A40: =(A39+1) -> 35 | B40: 12.09 | C40: Gerardo Esto Cruz | D40: DNI | E40: 17802594 | F40: Visita | G40: Dr. Victor Garcia Toma | I40: 12.13
A41: =(A40+1) -> 36 | B41: 12.14 | C41: Germán Muñoz | D41: DNI | E41: 07937479 | F41: Visita | G41: Dr. Alzamora | I41: 13.55
A42: =(A41+1) -> 37 | B42: 12.34 | C42: Richard Ruiz | D42: DNI | E42: 06882014 | F42: Abastecimient | G42: Sr. Jorge Borda | I42: 18.20
A43: =(A42+1) -> 38 | B43: 12.47 | C43: Miguel Reyes | D43: DNI | E43: 40189604 | F43: Abastecimient | G43: Sr. Jorge Borda | I43: 12.51
A44: =(A43+1) -> 39 | B44: 12.50 | C44: Maria Dragg | D44: DNI | E44: 25796182 | F44: Of.Bienestar | G44: Dra.Doris Diaz | I44: 13.10
A45: =(A44+1) -> 40 | B45: 12.51 | C45: Rafael Bardelli | D45: DNI | E45: 08814756 | F45: Visita | G45: Dr. Juan Baustista Bardelli Lartirigoyen | I45: 13.22
A46: =(A45+1) -> 41 | B46: 13.03 | C46: Luz Bedon | D46: DNI | E46: 44009675 | F46: Sala 1 | G46: Sr.Corcuera | H46: Refrigerio | I46: 15.14
A47: =(A46+1) -> 42 | B47: 13.05 | C47: Ricardo Noriega | D47: DNI | E47: 91552298 | F47: Visita | G47: Dr. Juan Baustista Bardelli Lartirigoyen | I47: 14.10
A48: =(A47+1) -> 43 | B48: 13.05 | C48: José Noriega | D48: DNI | E48: 09136621 | F48: Visita | G48: Dr. Juan Baustista Bardelli Lartirigoyen | I48: 14.10
A49: =(A48+1) -> 44 | B49: 13.08 | C49: Digna Carhuallanqui | D49: DNI | E49: 19838120 | F49: Asesores | G49: Dra.Rosado | H49: Refrigerio | I49: 13.53
A50: =(A49+1) -> 45 | B50: 13.15 | C50: Rolando Melgar | D50: DNI | E50: 08555189 | F50: G.General | G50: Dr. Oscar del Rio | I50: 15.14
A51: =(A50+1) -> 46 | B51: 14.01 | C51: Pedro Grandez | D51: DNI | E51: 09461824 | F51: Visita | G51: Dr. Magdiel Gonzales Ojeda | I51: 15.15
A52: =(A51+1) -> 47 | B52: 14.13 | C52: Rosa Alvarado | D52: DNI | E52: 25730168 | F52: Visita | G52: Dr. Juan Baustista Bardelli Lartirigoyen | I52: 14.46
A53: =(A52+1) -> 48 | B53: 14.13 | C53: Juan Balta O. | D53: DNI | E53: 07960058 | F53: Visita | G53: Dr. Juan Baustista Bardelli Lartirigoyen | I53: 15.15
A54: =(A53+1) -> 49 | B54: 14.13 | C54: Pedro Balta S | D54: DNI | E54: 40906654 | F54: Visita | G54: Dr. Juan Baustista Bardelli Lartirigoyen | I54: 15.15
A55: =(A54+1) -> 50 | B55: 14.16 | C55: Javier Silva | D55: DNI | E55: 16023406 | F55: Visita | G55: Dr. Juan Baustista Bardelli Lartirigoyen | I55: 14.54
A56: =(A55+1) -> 51 | B56: 14.23 | C56: Teresa Meneses | D56: DNI | E56: 07662639 | F56: Asesor Legal | G56: Dr.Dumet | I56: 14.30
A57: =(A56+1) -> 52 | B57: 14.25 | C57: Andrés Moreano | D57: DNI | E57: 40177866 | F57: Abastecimient | G57: Sra.Linares | I57: 15.00
A58: =(A57+1) -> 53 | B58: 14.36 | C58: Rafael Bardelli | D58: DNI | E58: 08814756 | F58: Visita | G58: Dr. Juan Baustista Bardelli Lartirigoyen | I58: 14.48
A59: =(A58+1) -> 54 | B59: 14.56 | C59: Jesús Ramos | D59: DNI | E59: 01999463 | F59: Visita | G59: Dr. César Landa Arroyo | I59: 15.11
A60: =(A59+1) -> 55 | B60: 15.05 | C60: Elsa Chavez | D60: DNI | E60: 16683634 | F60: Personal | G60: Sra.Ordoñez | I60: 15.29
A61: =(A60+1) -> 56 | B61: 15.09 | C61: Juan Tito C. | D61: DNI | E61: 41411344 | F61: Mantenimiento | G61: Sr.Rosales | I61: 16.54
A62: =(A61+1) -> 57 | B62: 15.09 | C62: Alfredo Mendiola | D62: DNI | E62: 21491933 | F62: Visita | G62: Dr. Juan Baustista Bardelli Lartirigoyen | I62: 15.25
A63: =(A62+1) -> 58 | B63: 15.45 | C63: Fernando Peña | D63: DNI | E63: 06069781 | F63: Abastecimient | G63: Sr. Jorge Borda | I63: 15.48
A64: =(A63+1) -> 59 | B64: 15.47 | C64: María Dragg | D64: DNI | E64: 25796182 | F64: G.General | G64: Dr. Oscar del Rio | I64: 15.56
A65: =(A64+1) -> 60 | B65: 15.52 | C65: María Cabañas | D65: DNI | E65: 07413962 | F65: Silsa | G65: Silsa | I65: 16.30
A66: =(A65+1) -> 61 | B66: 15.54 | C66: Andrés Gracia | D66: DNI | E66: 09194496 | F66: Abastecimient | G66: Sr. Jorge Borda | I66: 15.58
A67: =(A66+1) -> 62 | B67: 16.04 | C67: Emilio Enríquez | D67: DNI | E67: 09306730 | F67: Visita | G67: Dr. Juan Baustista Bardelli Lartirigoyen | I67: 16.06
A68: =(A67+1) -> 63 | B68: 16.24 | C68: EugenioLopez | D68: DNI | E68: 42355314 | F68: Visita | G68: Dr. Carpio | I68: 16.26
A69: =(A68+1) -> 64 | B69: 16.34 | C69: Susana Ramírez | D69: DNI | E69: 00207837 | F69: Visita | G69: Dr. Juan Baustista Bardelli Lartirigoyen | I69: 16.40
A70: =(A69+1) -> 65 | B70: 16.36 | C70: Marysol Fernández | D70: DNI | E70: 09127735 | F70: Edec n | G70: Cmdte.Cumpa | I70: 17.06
A71: =(A70+1) -> 66 | B71: 16.38 | C71: Hector Santibañez | D71: DNI | E71: 08430367 | F71: Secre.General | G71: Dr. Carlos Pelaez Camacho | I71: 16.48
A72: =(A71+1) -> 67 | B72: 16.38 | C72: Carlos Gutiérrez | D72: DNI | E72: 41337352 | F72: Secre.General | G72: Dr. Carlos Pelaez Camacho | I72: 16.48
A73: =(A72+1) -> 68 | B73: 16.46 | C73: Ivonne Díaz | D73: DNI | E73: 41445039 | F73: Tesorer¡a | G73: Sr.Olazabal | I73: 16.50
A74: =(A73+1) -> 69 | B74: 17.15 | C74: Gladys Nuñez | D74: DNI | F74: Abastecimient | G74: Sr. Jorge Borda | I74: 17.19
A75: =(A74+1) -> 70 | B75: 17.22 | C75: Arnaldo Cortes | D75: DNI | E75: 80043631 | F75: G.General | G75: Dr. Oscar del Rio | I75: 17.35